skill_query,title,description,source,publishedAt,platform
Python,New Python Documentary Released On YouTube,"""From a side project in Amsterdam to powering AI at the world's biggest companies — this is the story of Python,"" says the description of a new 84-minute documentary. 

Long-time Slashdot reader destinyland writes:
It traces Python all the way back to its ori…",Slashdot.org,2025-08-30T14:34:00+00:00,NewsAPI
Python,Massive monster: See the longest snake caught in the 2025 Florida Python Challenge,Longest python caught in the 2025 Florida Python Challenge was recorded in the Novice category. Plus a look at some of the biggest snakes ever caught.,Palm Beach Post,2025-09-22T14:55:09+00:00,NewsAPI
Python,Nvmath-Python: Nvidia Math Libraries for the Python Ecosystem,NVIDIA Math Libraries for the Python Ecosystem. Contribute to NVIDIA/nvmath-python development by creating an account on GitHub.,Github.com,2025-09-18T22:37:44+00:00,NewsAPI
Python,Python-Style Kwargs in TypeScript,"A pain-free way to write expressive, readable typed option bags in TypeScript.",Xavd.id,2025-09-22T08:25:53+00:00,NewsAPI
Python,"Python on the Edge: Fast, sandboxed, and powered by WebAssembly","With AI workloads on the rise, the demand for Python support on WebAssembly on the Edge has grown rapidly.

However, bringing Python to WebAssembly is...",Wasmer.io,2025-09-24T15:48:36+00:00,NewsAPI
Python,Sharing a mutable reference between Rust and Python,"Background As part of my ongoing project to reimplement Django’s templating language in Rust, I have been adding support for custom template tags.
Simple tags The simplest custom tag will look something like:
# time_tags.py from datetime import datetime from …",Lilyf.org,2025-09-03T13:30:25+00:00,NewsAPI
Python,Why Today's Python Developers Are Embracing Type Hints,What is Typed Python? Why is it important for Python developers today? How to can you get started?,Pyrefly.org,2025-09-24T11:23:54+00:00,NewsAPI
Python,Further Adventures in Colorimeter Hacking,"One of the great things about sharing hacks is that sometimes one person’s work inspires someone else to take it even further. A case in point is [Ivor]’s colorimeter hacking (parts two and three),…",Hackaday,2025-09-09T11:00:08+00:00,NewsAPI
Python,Measuring Nanoparticles by Scattering a Laser,"A fundamental difficulty of working with nanoparticles is that your objects of study are too small for an optical microscope to resolve, and thus measuring their size can be quite a challenge. Of c…",Hackaday,2025-08-30T08:00:04+00:00,NewsAPI
Python,Python has had async for 10 years – why isn't it more popular?,A deep-dive into the challenges and misconceptions surrounding async programming in Python,Github.io,2025-09-02T17:24:57+00:00,NewsAPI
Python,Debugging vs Printing,"We’ll admit it. We have access to great debugging tools and, yes, sometimes they are invaluable. But most of the time, we’ll just throw a few print statements in whatever program we&#82…",Hackaday,2025-09-11T08:00:46+00:00,NewsAPI
Python,Reverse Engineering a (Toy) Fire Engine,Your kid has a toy remote control fire truck. You have an RTL SDR. See where this is going? [Jacob] couldn’t resist tearing into the why and how of the truck’s remote control protocol. …,Hackaday,2025-09-07T02:00:00+00:00,NewsAPI
Python,A noise attack on license plate readers (Flock AI),"A quick and simple way to automate small, hardly-noticeable, random gaussian shapes to confuse AI license plate readers used by law enforcement and retailers.  - GitHub - bennjordan/PlateShapez: A ...",Github.com,2025-09-06T02:08:43+00:00,NewsAPI
Python,Show HN: Nallely – A Python signals/MIDI processing system inspired by Smalltalk,"Nallely is an experimental organic system for advanced MIDI patching, live coding, generative music, and multimodal art, built for hacker/musicians, developed in Python, inspired by Smalltalk and Systems as Living Things",Github.io,2025-09-19T00:09:27+00:00,NewsAPI
Python,I got the highest score on ARC-AGI again swapping Python for English,Using Multi-Agent Collaboration with Evolutionary Test-Time Compute,Substack.com,2025-09-17T01:53:47+00:00,NewsAPI
Python,"Wind and Solar Will Power Datacenters More Cheaply Than Nuclear, Study Finds","An anonymous reader quotes a report from The Register: Renewable energy sources could power datacenters at a lower cost than relying on nuclear generation from small modular reactors (SMRs), claims a recently revealed study. ... [A]nalysis from the Centre for…",Slashdot.org,2025-09-27T03:30:00+00:00,NewsAPI
Python,"As a local, I've visited many of Scotland's castles. There's one tourists can probably skip — and 4 they shouldn't miss.","I've visited over a dozen of Scotland's most popular castles. I'd go back to Stirling and Doune, but Edinburgh Castle didn't feel worth the hype.",Business Insider,2025-09-20T13:42:01+00:00,NewsAPI
Python,First Transistor Computer Reborn,"Ok, we’ll admit it. If you asked us what the first transistorized computer was, we would have guessed it was the TC from the University of Manchester. After all, Dr. Wilkes and company were a…",Hackaday,2025-09-22T02:00:01+00:00,NewsAPI
Python,Silent No More: Open-Source Fix for Mic Mishaps,"“Sorry, my mic was muted…” With the rise of video calls, we’ve all found ourselves rushing to mute or unmute our mics in the midst of a call. This open-source Mute Button, s…",Hackaday,2025-08-30T20:00:00+00:00,NewsAPI
Python,How An Attacker's Blunder Gave Us a Rare Look Inside Their Day-to-Day Operations,"An attacker installed Huntress onto their operating machine, giving us a detailed look at how they’re using AI to build workflows, searching for tools like Evilginx, and researching targets like software development companies.",Huntress.com,2025-09-09T15:42:32+00:00,NewsAPI
Python,$400 exoskeleton suit built from threads and motors delivers lifelike VR feedback,"Kinethreads exosuit uses fabric threads, motors, and a Raspberry Pi to deliver lifelike VR haptics and rehab support for under $500.",interestingengineering,2025-09-29T23:16:40,NewsData
Python,D-Wave Quantum (NYSE:QBTS) Shares Down 5.6% – Here’s What Happened,"D-Wave Quantum Inc. (NYSE:QBTS – Get Free Report) fell 5.6% during mid-day trading on Monday . The stock traded as low as $24.97 and last traded at $25.27. 68,602,136 shares changed hands during trading, an increase of 6% from the average session volume of 64,851,969 shares. The stock had previously closed at $26.76. Wall Street [...]",themarketsdaily,2025-09-29T23:14:47,NewsData
Python,"‘Louis Theroux Podcast’ Sets Season 6 Guests: Florence Pugh, David Byrne, Malala Yousafzai and More (EXCLUSIVE)","“The Louis Theroux Podcast” has unveiled its slate of Season 6 guests, including Florence Pugh, David Byrne and Malala Yousafzai. The Spotify and Mindhouse podcast, hosted by the award-winning British journalist, will debut new episodes starting Oct. 7. Alongside Pugh, Byrne and Yousafzai, other big names sitting down with Theroux include comedian and writer Steve [...]",variety,2025-09-29T23:01:00,NewsData
Python,TekaSketch: Where Etch A Sketch Meets Graph Theory,"The Etch A Sketch was never supposed to meet a Raspberry Pi, a camera, or a mathematical algorithm, but here we are. [Tekavou]’s Teka-Cam and TekaSketch are a two-part hack ...read more",hackaday,2025-09-29T23:00:01,NewsData
Python,"Crypto, VPNs & CCTV inside high-tech movie piracy hunt",,toi,2025-09-29T22:58:48,NewsData
Python,Custom Email Notifications for Databricks Pipeline Failures,"This blog walks through approaches to implement custom notifications using SMTP, SendGrid, Azure Logic Apps, and Microsoft Graph API. Using SMTP with Python inside a Databricks notebook, you can generate an Excel report and send it via email whenever a pipeline fails.",hackernoon,2025-09-29T22:13:45,NewsData
Python,"This lightweight IDE runs on basically everything, and it supports custom plugins","Discover Geany, the fast and lightweight IDE that runs on any system, supports custom plugins, and provides essential features for efficient coding across multiple languages.",xda_developers,2025-09-29T22:00:20,NewsData
Python,Britney Spears enrages Hollywood bosses with 'erratic' antics... as insiders tell of dire behind the scenes mood on singer's biopic,"Two years ago Britney Spears dropped her bombshell memoir, The Woman in Me, and launched a fierce bidding war over the rights to adapt the tell-all book into a Hollywood movie.",dailymailuk,2025-09-29T21:46:36,NewsData
Python,"Inside North Korea’s DeceptiveDevelopment Job Fraud, Malware Scheme","DeceptiveDevelopment blends job fraud and malware, using social engineering and insider tactics to compromise developers and crypto firms.The post Inside North Korea’s DeceptiveDevelopment Job Fraud, Malware Scheme appeared first on eSecurity Planet.",esecurityplanet,2025-09-29T21:36:21,NewsData
Python,Mid Cap Stocks To Consider – September 29th,"Merus, AltC Acquisition, Rigetti Computing, Marathon Digital, and D-Wave Quantum are the five Mid Cap stocks to watch today, according to MarketBeat’s stock screener tool. Mid-cap stocks are shares of companies whose total market capitalization generally falls between roughly $2 billion and $10 billion. They typically offer investors a balance between the stability of large-cap [...]",thelincolnianonline,2025-09-29T21:18:45,NewsData
Python,Python for Data Science (Free 7-Day Mini-Course),,KDnuggets,2025-09-30T17:21:00.957719,GoogleNews
Python,Meet oLLM: A Lightweight Python Library that brings 100K-Context LLM Inference to 8 GB Consumer GPUs via SSD Offload—No Quantization Required,,MarkTechPost,2025-09-30T17:21:00.958360,GoogleNews
Python,CodeQL zero to hero part 5: Debugging queries,,The GitHub Blog,2025-09-30T17:21:00.958580,GoogleNews
Python,Iman Proves Snakeskin’s Staying Power in Tod’s Python Boots at Milan Fashion Week,,WWD,2025-09-30T17:21:00.958746,GoogleNews
Python,Can You Make a Living Hunting Pythons? We Asked Florida’s Invasive Snake Contractors,,Outdoor Life,2025-09-30T17:21:00.958902,GoogleNews
Python,Hunt is on for two pythons on the loose in Queens' Forest Park,,NBC New York,2025-09-30T17:21:00.959043,GoogleNews
Python,Oracle's GraalVM To Shift Focus To Non-Java Languages Like Python & JavaScript,,Phoronix,2025-09-30T17:21:00.959180,GoogleNews
Python,Police searching for suspect accused of stealing ball python from Colorado pet store,,KKTV,2025-09-30T17:21:00.959316,GoogleNews
Python,"4-foot python recovered from Forest Park, Queens. 2 are still missing",,CBS News,2025-09-30T17:21:00.959457,GoogleNews
Python,How to Use pandas DataFrames in Python to Analyze and Manipulate Data,,How-To Geek,2025-09-30T17:21:00.959604,GoogleNews
Python,"Snakes missing in NYC: One python rescued by Puppy Kitty NYC, two others on the loose in Queens",,ABC7 New York,2025-09-30T17:21:00.959746,GoogleNews
Python,Robotic rabbits are deployed in South Florida python hot spots to fight snake explosion,,The Palm Beach Post,2025-09-30T17:21:00.959892,GoogleNews
Python,Burmese python vomits out a whole deer in Florida: A ‘stunning survival moment’ in the wild,,The Times of India,2025-09-30T17:21:00.960051,GoogleNews
Python,pyForth – a Forth implementation in Python,,Adafruit,2025-09-30T17:21:00.960211,GoogleNews
Python,"‘Communal’ python nesting site on Florida island had dozens of eggs, video shows",,Miami Herald,2025-09-30T17:21:00.960361,GoogleNews
Python,"I replaced all my bash scripts with Python, and here’s what happened",,XDA,2025-09-30T17:21:00.960508,GoogleNews
Python,Python and Poetry: 4 tools for keeping Python simple,,InfoWorld,2025-09-30T17:21:00.960658,GoogleNews
Python,I Spent a Grueling 10 Days Doing Nothing but Catching Pythons. Then Something Incredible Happened.,,Slate,2025-09-30T17:21:00.960823,GoogleNews
Python,"Python P Breaks Down Long Term Friendship with Ab-Soul, Production & New Al",,Power 100.9,2025-09-30T17:21:00.960968,GoogleNews
Python,9-foot albino python found in Coventry; police searching for owner,,WFSB,2025-09-30T17:21:00.961103,GoogleNews
Python,Why Students Use FindMyGuru to Find Tutors in India?,"Every student’s journey is unique. Some of us want to ace IIT-JEE, some dream of mastering Python programming, while others may want to simply speak English more confidently. But one thing remains common — finding the right mentor makes all the difference. That’s where **FindMyGuru comes in to help students find tutors in India**.",teaching,2025-09-30T17:11:30,Reddit
Python,Looking for Data Science professional (Middleperson),"**Key Responsibilities**

* Review and refine AI-generated prompts, responses, and code
* Validate concepts for technical accuracy
* Provide structured feedback on solution quality and clarity
* Tag and organize content by topic and difficulty
* Support benchmarking efforts to assess model capabilities

**Ideal Qualifications**

* 3+ years of experience in data science, machine learning, or applied statistics (industry or research)
* Degree in Data Science, Statistics, Computer Science, Applied Mathematics, or a related quantitative field (Bachelor’s minimum; advanced degree preferred)
* Strong proficiency in Python and SQL; familiarity with R, Java, or Scala is a plus
* Hands-on experience building and deploying machine learning models using frameworks like scikit-learn, TensorFlow, or PyTorch
* Experience with statistical analysis, data wrangling, and feature engineering on large datasets

**Project Timeline**

* Start Date: Immediate
* Duration: 1–2 months
* Commitment: Part-time (15–25 hours/week, with flexibility up to 40 hours/week)
* Schedule: Fully remote and asynchronous – flexible working hours

**Compensation &amp; Contract**

* Competitive hourly rate based on experience ($70–$120 USD/hr)
* Independent contractor
* Daily payment via Stripe Connect

**Application &amp; Onboarding Process**

* Upload your resume
* AI interview: A short, 15-minute conversational session to understand your background, experience, and interest in the role
* Follow-up communication within a few days with next steps and onboarding details

DM for the application link.",DeveloperJobs,2025-09-30T17:11:22,Reddit
Python,How to build website for a small business,"I am building a small business of jewelry. I want to start with 0 investment in the website of my brand. Shopify, wordpress and wix are monthly paid platforms. Should I code frontend and backend and connect to free database? I am thinking to use react + tailwind on the frontend and flask, python, razorpay API on the backend. For database, I am using MongoDB. Can you all tell if this is right thing? I am up for suggestion. Also, know that i am from tech bg. Would coding my side would be a write action to take?",smallbusiness,2025-09-30T17:10:50,Reddit
Python,"9.5 h (4.5 stars)- Master Web Development: HTML5, Python, &amp; Flask Framework",,udemyfreebies,2025-09-30T17:07:55,Reddit
Python,Trying To Use stable diffusion with AMD and CHATGPT,"Every step I get stuck from chatgpt. It's like they're intentionally trolling me or I am just plain stupid.

I just don't get what is trying to tell me. What does step 2 even mean go to Mathetica save as wtf is that?

I need instructions an 3 yr old can understand.

https://preview.redd.it/8hoqd00hgasf1.png?width=803&amp;format=png&amp;auto=webp&amp;s=a89d6420d3a5ecde52bc2468461f02d84ae1090f",StableDiffusion,2025-09-30T17:06:46,Reddit
Python,"Stories from running a workflow engine, e.g., Hatchet, in Production","Hi everybody! I find myself in need of a workflow engine (I'm DevOps, so I'll be using it and administering it), and it seems the Python space is exploding with options right now. I'm passingly familiar with Celery+Canvas and DAG-based tools such as Airflow, but the hot new thing seems to be Durable Execution frameworks like Temporal.io, DBOS, Hatchet, etc. I'd love to hear stories from people actually using and managing such things in the wild, as part of evaluating which option is best for me.

Just from reading over these projects docs, I can give my initial impressions:

* Temporal.io - enterprise-ready, lots of operational bits and bobs to manage, seems to want to take over your entire project
* DBOS - way less operational impact, but also no obvious way to horizontally scale workers independent of app servers (which is sort of a key feature for me)
* Hatchet - evolving fast, Durable Execution/Workflow bits seem fairly recent, no obvious way to logically segment queues, etc. by tenant (Temporal has Namespaces, Celery+Canvas has Virtual Hosts in RabbitMQ, DBOS… might be leveraging your app database, so it inherits whatever you are doing there?)

Am I missing any of the big (Python) players? What has your experience been like?",Python,2025-09-30T17:04:07,Reddit
Python,Ship stats comparison tool - compare the stats of ships with each other or with means and medians,"Wrote a simple comparison tool in python. It has two functionalities: to compare the stats of a selected ship with the means and medians of other ships in the same class to see where it stands, and to simply bring up the stats of two ships side by side to allow for at a glance comparison. Here is the link to the repo:

The data is from the Azur Lane wiki list of stats of all ships. It currently has no UI and so simply runs in the terminal. The main program is in the form of the .exe file in the repo but the source code is also present in the repo.

People may be rightfully apprehensive about downloading and running an .exe file from a random on the internet, so if one has python installed, they can instead just download the entire repo and run the .py file. If you'd rather not download anything at all then I can understand that too. A tool like this it would be best presented as a web page. 

The ultimate goal would be easy side by side comparison of the theoretical performance between ships as well as how their theoretical performance fits in with ships of the same class, same class and rarity etc. which of course you'd need to take into account efficiencies and skills. I suppose my two main questions in this post are: 

1. Is there a tool already out there that already does this?  
2. If not, is this even worth further looking into? Would it be useful? ",AzureLane,2025-09-30T17:03:44,Reddit
Python,Imagine the existential horror of finding out you're an AI inside Minecraft,"""I built a small language model in Minecraft using no command blocks or datapacks!

The model has 5,087,280 parameters, trained in Python on the TinyChat dataset of basic English conversations. It has an embedding dimension of 240, vocabulary of 1920 tokens, and consists of 6 layers. The context window size is 64 tokens, which is enough for (very) short conversations. Most weights were quantized to 8 bits, although the embedding and LayerNorm weights are stored at 18 and 24 bits respectively. The quantized weights are linked below; they are split into hundreds of files corresponding to the separate sections of ROM in the build.

The build occupies a volume of 1020x260x1656 blocks. Due to its immense size, the Distant Horizons mod was used to capture footage of the whole build; this results in distant redstone components looking strange as they are being rendered at a lower level of detail.

It can produce a response in about 2 hours when the tick rate is increased using MCHPRS (Minecraft High Performance Redstone Server) to about 40,000x speed.""

Source: [https://www.youtube.com/watch?v=VaeI9YgE1o8](https://www.youtube.com/watch?v=VaeI9YgE1o8)",ChatGPT,2025-09-30T17:03:13,Reddit
Python,Imagine the existential horror of finding out you're an AI inside Minecraft,"""I built a small language model in Minecraft using no command blocks or datapacks!

The model has 5,087,280 parameters, trained in Python on the TinyChat dataset of basic English conversations. It has an embedding dimension of 240, vocabulary of 1920 tokens, and consists of 6 layers. The context window size is 64 tokens, which is enough for (very) short conversations. Most weights were quantized to 8 bits, although the embedding and LayerNorm weights are stored at 18 and 24 bits respectively. The quantized weights are linked below; they are split into hundreds of files corresponding to the separate sections of ROM in the build.

The build occupies a volume of 1020x260x1656 blocks. Due to its immense size, the Distant Horizons mod was used to capture footage of the whole build; this results in distant redstone components looking strange as they are being rendered at a lower level of detail.

It can produce a response in about 2 hours when the tick rate is increased using MCHPRS (Minecraft High Performance Redstone Server) to about 40,000x speed.""

Source: [https://www.youtube.com/watch?v=VaeI9YgE1o8](https://www.youtube.com/watch?v=VaeI9YgE1o8)",artificial,2025-09-30T17:02:35,Reddit
Python,Imagine the existential horror of finding out you're an AI inside Minecraft,"""I built a small language model in Minecraft using no command blocks or datapacks!  
  
The model has 5,087,280 parameters, trained in Python on the TinyChat dataset of basic English conversations. It has an embedding dimension of 240, vocabulary of 1920 tokens, and consists of 6 layers. The context window size is 64 tokens, which is enough for (very) short conversations. Most weights were quantized to 8 bits, although the embedding and LayerNorm weights are stored at 18 and 24 bits respectively. The quantized weights are linked below; they are split into hundreds of files corresponding to the separate sections of ROM in the build.  
  
The build occupies a volume of 1020x260x1656 blocks. Due to its immense size, the Distant Horizons mod was used to capture footage of the whole build; this results in distant redstone components looking strange as they are being rendered at a lower level of detail.  
  
It can produce a response in about 2 hours when the tick rate is increased using MCHPRS (Minecraft High Performance Redstone Server) to about 40,000x speed.""  
  
Source: [https://www.youtube.com/watch?v=VaeI9YgE1o8](https://www.youtube.com/watch?v=VaeI9YgE1o8)",OpenAI,2025-09-30T17:01:39,Reddit
Python,Beyond the Lore: My Concept for a Real-World Glimmer.,"What I am gonna share is not more sci-fi this is real thing nor fandiction. This doc is based on real scientific research paper and the real scientific study going on. This doc states the real road map to make a **Glimmer** or more genericaly speaking a **Photonic crystal** that stores light. (This what possible with modern technolgy right now) . Why I am shareing this because I am just a collage student I don't have a team nor lab to do this. What I need an actual lab and budget to this research.😓

# Phase 1: Understand and Model the Physics

1. **Literature Sweep**
   * Gather seminal and recent papers on photon storage, slow light, and light trapping in photonic crystals and resonators.
   * Focus on mechanisms like Electromagnetically Induced Transparency (EIT), cavity QED, and photon–atom hybrid states.
2. **Build a Simple Python Model**
   * Implement Maxwell’s equations for a 1D photonic crystal using libraries such as MPB or MEEP.
   * Verify that a photonic bandgap stops targeted wavelengths.

# Phase 2: Design and Optimize the Photonic Crystal

1. **Parametric Crystal Design**
   * Write Python scripts to sweep parameters: lattice spacing, refractive index contrasts, defect-cavity geometries.
   * Compute bandgaps and identify configurations that maximize photon dwell time.
2. **Quantum-Level Loss Mitigation**
   * Conceptualize error-correction via periodic control pulses or active feedback loops to compensate for scattering and absorption losses.

# Phase 3: Simulate the “Solidified” Light System

1. **Material + Control Algorithm Integration**
   * Combine the optimized crystal model with a feedback algorithm (PID controller or RL agent) to actively maintain photon confinement.
2. **Quantify Energy Storage**
   * Calculate how many photons at a given wavelength can be trapped and for how long.
   * Derive the effective energy density (“10 g stores 10 kJ” scale estimates).

# Phase 4: Prototype Fabrication and Testing

1. **Lab Collaboration**
   * Partner with a nanofabrication facility or maker space capable of nanoimprint lithography, electron-beam lithography, or self-assembly.
   * Start with microsphere or waveguide test structures if full photonic-crystal fabrication is unavailable.
2. **Iterative Loop**
   * Fabricate test pieces, measure confinement lifetimes and losses.
   * Feed experimental data back into the Python optimization scripts for next-generation designs.

# Phase 5: Define and Develop the “Glimmer” Product

1. **Concept Specification**
   * Decide on Glimmer’s form factor: a light-battery module, a photonic memory element, or a functional light block.
   * Design the release mechanism—controlled energy discharge, optical signaling, or visual display.
2. **Documentation and IP Strategy**
   * Record experimental methods, simulation code, and performance metrics.
   * File provisional patents or prepare publications to protect and communicate your innovation.",DestinyLore,2025-09-30T17:01:03,Reddit
