skill_query,title,description,source,publishedAt,platform
Rust,"[Store] 300+ KNIVES AND GLOVES e.g. Cool Mint FT &amp; Vice FT and WW &amp; Slingshot FT, Butterfly Slaughter FN &amp; Rust Coat &amp; Crimson BS, Talon Tiger Tooth &amp; Vanilla &amp; Slaughter FT, M9 Doppler FN P3 &amp; Vanilla ST, Bayonet Gamma Doppler FN P2, Skeleton Ruby FN ST &amp; Marble Fade FN &amp; Slaughter FN &amp; many more","Taking CS skins mainly (knives, gloves, aks, m4s, awps and so on). Anything as long as offer is good.

I don't update this list everyday, so I have many items which aren't listed here. Check if something interests you! Also, some of the items are on trade hold, for release date you can add me and ask.

TRADE LINK: [https://steamcommunity.com/tradeoffer/new/?partner=35769104&amp;token=J30wyEpy](https://steamcommunity.com/tradeoffer/new/?partner=35769104&amp;token=J30wyEpy)

Add me to talk here: [https://steamcommunity.com/profiles/76561197996034832](https://steamcommunity.com/profiles/76561197996034832)

Gloves/wraps:

Gloves Cool Mint FT - B/O 2000$

Gloves Crimson Weave FT - B/O 1350$

Gloves Vice FT - B/o 1180$

Gloves Slingshot FT - B/O 980$

Gloves Vice WW - B/O 920$

Gloves Amphibious FT - B/O 910$

Gloves Lunar Weave FT - B/O 700$

Gloves Slingshot WW - B/O 680$

Gloves Boom FT - B/O 590$

Gloves Arid BS - B/O 530$

Gloves Snow Leopard WW - B/O 480$

Wraps Cobalt Skulls FT - B/O 475$

Gloves Scarlet Shamagh FT - B/O 450$

Wraps Badlands FT - B/O 430$

Gloves Turtle MW - B/O 420$

Gloves Big Game FT - B/o 395$

Gloves Crimson Web FT - B/O 340$

Gloves Fade WW - B/O 315$

Gloves Marble Fade FT - B/O 300$

Gloves Black Tie FT - B/O 290$

Wraps CAUTION FT - B/O 261$

Gloves Crimson Web WW - B/O 257$

Wraps Leather BS - B/O 251$

Gloves Big Game BS - B/O 246$

Gloves Blood Pressure FT - B/O 243$

Gloves Bronzed MW - B/O 231$

Gloves Field Agent WW - B/O 231$

Gloves Black Tie WW - B/O 231$

Gloves Lt. Commander FT - B/O 228$

Gloves Fade BS - B/O 208$

Gloves King Snake BS - B/O 205$

Gloves Polygon WW - B/O 201$

Wraps CAUTION BS - B/O 199$

Gloves Yellow-banded MW - B/O 195$

Wraps Duct Tape MW - B/O 185$

Gloves Turtle FT - B/O 180$

Gloves Lt. Commander BS - B/O 171$

Gloves Smoke Out BS - B/O 163$

Gloves Jade FT - B/O 160$

Gloves Unhinged MW - B/O 157$

Gloves Guerrilla BS - B/O 156$

Gloves Snakebite FT - B/O 138$

Gloves Case Hardened FT - B/O 135$

Gloves Rezan the Red BS - B/O 128$

Gloves Racing Green MW - B/O 121$

Gloves Snakebite BS - B/O 121$

Gloves Turtle BS - B/O 119$

Gloves Bronzed BS - B/O 107$

Gloves Buckshot MW - B/O 103$

Gloves Unhined FT - B/O 94$

Gloves Queen Jaguar BS - B/O 91$

Gloves Needle Point WW - B/O 87$

Gloves 3rd Commando Company FT - B/O 84$

Gloves Needle Point BS - B/O 81$

Gloves Rattler WW - B/O 69$

Gloves Racing Green FT - B/O 63$

Gloves Rattler FT - B/O 63$

Knives and high tier items:

Butterfly Slaughter FN - B/O 3000$

Butterfly Rust Coat BS - B/O 990$

Butterfly Rust Coat BS ST - B/O 981$

Butterfly Crimson Web BS - B/O 980$

Butterfly Urban Masked FT - B/O 815$

Butterfly Safari Mesh FT - B/O 780$

Karambit Freehand FT - B/O 911$

Karambit Boreal Forest MW - B/O 770$

Karambit Urban Masked FT - B/O 705$

Karambit Safari Mesh FT - B/O 650$

M9 Doppler FN P3 - B/O 1980$

M9 Vanilla ST - B/O 1400$

M9 Crimson Web FT - B/O 770$

M9 Freehand FT - B/O 666$

Bayonet Doppler FN P4 - B/O 746$

Bayonet Marble Fade FN - B/o 670$

Bayonet Lore MW - B/O 575$

Bayonet Tiger Tooth FN - B/O 550$

Bayonet Autotronic FT - B/O 460$

Bayonet Case Hardened WW - B/O 375$

Bayonet Lore BS - B/O 360$

Bayonet Night MW - B/O 313$

Bayonet Crimson Web BS - B/O 278$

Bayonet Freehand FT - B/O 277$

Bayonet Urban Masked FT - B/O 209$

Bayonet Scorched BS - B/O 206$

Bayonet Forest Ddpat BS - B/O 191$

Talon Tiger Tooth FN - B/O 831$

Talon Slaughter FT - B/O 777$

Talon Vanilla - B/O 580$

Talon Vanilla ST - B/O 561$

Talon Damascus Steel FT - B/o 491$

Talon Forest Ddpat MW - B/O 365$

Talon Safari Mesh FT - B/O 303$

Skeleton Ruby FN ST - B/O 5300$

Skeleton Doppler FN ST P3 - B/O 1260$

Skeleton Marble Fade FN - B/O 885$

Skeleton Slaughter FN - B/O 855$

Skeleton Vanilla - B/O 626$

Skeleton Stained BS - B/O 308$

Skeleton Rust Coat BS - B/O 270$

Skeleton Boreal Forest FT - B/O 207$

Skeleton Boreal Forest FT ST - B/O 206$

Stiletto Doppler FN P1 - B/O 865$

Stiletto Slaughter FN - B/o 655$

Stiletto Slaughter MW - B/O 561$

Stiletto Slaughter FT - B/O 560$

Stiletto Vanilla - B/O 395$

Stiletto Crimson Web FT - B/O 370$

Stiletto Safari Mesh FN - B/O 322$

Stiletto Blue Steel WW ST - B/O 320$

Kukri Slaughter FN - B/O 338$

Kukri Night FN - B/O 280$

Kukri Case Hardened MW - B/O 232$

Kukri Crimson Web FT ST - B/O 200$

Classic Blue Steel MW - B/O 223$

Classic Blue Steel FT - B/O 207$

Classic Stained MW - B/O 188$

Classic Stained FT - B/O 180$

Classic Night MW - B/O 178$

Classic Stained FT ST - B/O 176$

Classic Scorched MW - B/O 167$

Classic Urban Masked FT - B/O 161$

Classic Stained BS - B/O 154$

Ursus Fade FN - B/O 456$

Ursus Slaughter FN - B/O 332$

Ursus Tiger Tooth FN - B/O 287$

Ursus Blue Steel FT ST - B/O 189$

Ursus Scorched FT - B/O 133$

Flip Doppler FN P1 - B/O 588$

Flip Marble Fade FN - B/O 480$

Flip Slaughter MW - B/O 433$

Flip Tiger Tooth FN - B/O 391$

Flip Autotronic FT - B/O 303$

Flip Crimson Web BS - B/O 236$

Flip Bright Water FT - B/O 205$

Flip Ultraviolet BS - B/O 205$

Flip Rust Coat BS - B/O 197$

Flip Stained FT - B/O 196$

Huntsman Marble Fade FN - B/O 355$

Huntsman Case Hardened FT - B/O 252$

Huntsman Crimson Web FT - B/O 182$

Huntsman Safari Mesh BS - B/O 122$

Nomad Vanilla - B/O 379$

Nomad Damascus Steel MW - B/O 286$

Nomad Stained BS - B/O 210$

Nomad Night FT - B/o 183$

Bowie Doppler FN P2 - B/O 557$

Bowie Lore FN ST - B/o 503$

Bowie Gamma Doppler FN P1 - B/O 405$

Bowie Fade FN - B/O 392$

Bowie Lore FN - B/O 354$

Bowie Marble Fade FN - B/O 318$

Bowie Case Hardened MW - B/O 287$

Bowie Black Laminate MW - B/O 144$

Bowie Black Laminate FT - B/O 129$

Bowie Black Laminate BS - B/O 122$

Bowie Rust Coat BS - B/O 106$

Falchion Slaughter MW - B/O 307$

Falchion Tiger Tooth FN - B/O 254$

Falchion Lore MW - B/O 215$

Falchion Vanilla - B/O 195$

Falchion Damascus Steel FN - B/O 191$

Falchion Crimson Web FT - B/O 188$

Falchion Blue Steel BS - B/O 186$

Falchion Freehand FT - B/O 155$

Falchion Forest Ddpat MW - B/O 135$

Falchion Scorched FT - B/O 125$

Falchion Boreal Forest FT - B/O 122$

Paracord Doppler FN P3 - B/O 386$

Paracord Fade FN - B/O 318$

Paracord Slaughter FN - B/O 286$

Paracord Marble Fade FN - B/O 259$

Paracord Slaughter MW - B/O 238$

Paracord Blue Steel MW - B/O 156$

Paracord Vanilla ST - B/O 145$

Paracord Blue Steel BS - B/O 138$

Paracord Scorched FT - B/O 95$

Paracord Rust Coat BS - B/O 92$

Paracord Forest Ddpat FT - B/O 88$

Survival Fade - B/O 295$

Survival Slaughter FN - B/O 242$

Survival Marble Fade FN - B/O 240$

Survival Slaughter FT - B/O 236$

Survival Slaughter MW - B/O 218$

Survival Tiger Tooth FN - B/O 201$

Survival Case Hardened FT - B/O 168$

Survival Crimson Web WW - B/O 161$

Survival Stained FT - B/O 119$

Survival Boreal Forest FT ST - B/O 109$

Survival Rust Coat BS - B/O 91$

Gut Lore FN - B/O 265$

Gut Fade FN - B/O 224$

Gut Slaughter FN - B/O 206$

Gut Marble Fade FN - B/O 205$

Gut Tiger Tooth FN ST - B/O 200$

Gut Tiger Tooth FN - B/O 184$

Gut Case Hardened FT - B/O 161$

Gut Freehand FN - B/O 142$

Gut Freehand MW - B/O 140$

Gut Crimson Web FT - B/O 133$

Gut Ultraviolet FT ST - B/O 130$

Gut Vanilla - B/O 130$

Gut Blue Steel WW - B/O 129$

Gut Black Laminate FT - B/O 114$

Gut Ultraviolet FT - B/O 111$

Daggers Doppler FN P4 - B/O 245$

Daggers Gamma Doppler FN P3 - B/O 188$

Daggers Slaughter FN - B/O 182$

Daggers Marble Fade FN - B/O 178$

Daggers Tiger Tooth FN - B/O 156$

Daggers Autotronic MW - B/O 125$

Daggers Freehand FN - B/O 125$

Daggers Autotronic BS - B/O 101$

Daggers Urban Masked FT - B/O 98$

Navaja Fade FN - B/O 184$

Navaja Tiger Tooth FN ST - B/O 168$

Navaja Slaughter FN - B/O 164$

Navaja Case Hardened MW - B/O 137$

Navaja Crimson Web FT - B/O 112$

Navaja Ultraviolet MW - B/O 111$

Navaja Ultraviolet FT ST - B/O 111$

Navaja Ultraviolet WW - B/O 90$

Navaja Rust Coat BS - B/O 83$

AK Fire Serpent BS - B/O 602$

M4 Fade FN - B/O 587$

AK Jet Set FT - B/O 461$

M4 In Living Color FN - B/O 311$

M4 Master Piece MW - B/O 293$

M4 Printstream FT - B/O 261$

M4 Eye of Horus FT - B/O 245$

Glock Gamma Doppler FN - B/O 238$

AK Panhtera Onca FT - B/O 231$

M4 Atomic Alloy FN - B/O 214$

USP Kill Confirmed MW - B/O 210$

USP Orion FN - B/O 209$

AWP Graphite FN - B/O 206$

AWP Containment Breach MW - B/o 196$

USP Whiteout MW - B/O 196$

M4 Neo Noir FN - B/o 195$

AK Case Hardened BS - B/O 195$

AK Case Hardened WW - B/O 194$

M4 Golden Coil BS ST - B/O 182$

AWP Oni Taiji WW - B/O 182$

M4 Master Piece FT Souvenir - B/O 166$

AK The Outsiders FN - B/O 161$

USP Monster Mashup FN - B/O 151$

AK Fuel Injector BS - B/O 144$

USP Orion MW ST - B/O 140$

M4 Golden Coil FT ST - B/O 140$

M4 The Coalition FT - B/O 138$

M4 Eye of Horus BS - B/O 137$

M4 Master Piece MW - B/O 134$

AWP Asiimov FT - B/O 133$

Deagle Cobalt Disruption FN - B/O 128$

M4 Chantico's Fire MW ST - B/O 127$

D Squadron Officer | NZSAS - B/O 125$

M4 Desolate Space FN - B/O 123$

AK Inheritance MW - B/O 119$

USP Neo Noir FN - B/O 110$

Bloody Darryl The Strapped - B/O 98$

AK Neon Rider FT ST - B/O 96$

AK Leet Museo FT ST - B/O 94$

M4 Buzz Kill MW - B/O 90$

Number K - B/O 89$",GlobalOffensiveTrade,2025-09-30T17:07:51,Reddit
Rust,Animated cover,[https://www.reddit.com/r/steamgrid/comments/dgtwb7/c\_rust\_design\_is\_from\_the\_poster\_they\_sell\_in\_the/?utm\_source=share&amp;utm\_medium=web3x&amp;utm\_name=web3xcss&amp;utm\_term=1&amp;utm\_content=share\_button](https://www.reddit.com/r/steamgrid/comments/dgtwb7/c_rust_design_is_from_the_poster_they_sell_in_the/?utm_source=share&amp;utm_medium=web3x&amp;utm_name=web3xcss&amp;utm_term=1&amp;utm_content=share_button),savevideoL,2025-09-30T16:52:18,Reddit
Rust,[EU] Vultaic | 2x Solo/Duo/Trio - Weekly Wipes on Monday,"**Vultaic** is a new server with **high performance** and **no pay to win** at all!

# Server Information

* 2x Gather and Stack Size
* Maximum of 3 players in a group
* Weekly wipes every Monday at 16:00 CEST
* **Zero** pay to win
* Always open to suggestions and feedback

If you're looking for a new server, give it a try. Always down to chat about Rust, whether you need help with anything technical, beginner questions, want to discuss upcoming updates or have ideas about the server and what would make it better. I've been playing this game for years and have seen some wild sh\*t with servers already.. From toxic admins to admin abuse and cheaters that are running around without active admins.

Even if you are not planning to play here at all or barely, I would appreciate any kind of feedback. Are you looking into this kind of server and what are your needs? Do you prefer vanilla or modded? Team limit or not? What makes you stick with a server long term?

# Server Details

**Name**: \[EU\] Vultaic | 2x Solo/Duo/Trio

**Wipe Schedule**: Every Monday at 16:00 CEST

**Location**: Europe

**Discord**: [https://discord.gg/UBXZTYM23x](https://discord.gg/UBXZTYM23x)",RustPc,2025-09-30T16:52:01,Reddit
Rust,Subway Station — survivors know: the best loot’s underground… and so are the worst nightmares | Battlemap | 40x30,"Beneath the ruined city, the subway station lies broken and silent. Cracked platforms stretch between rusted rails, while dead escalators lead to entrances buried in debris. Shattered ticket booths, scorched bathrooms, and dark utility rooms offer both cover and danger. In the flicker of failing lights, raiders, ghouls, and worse wait in the shadows—every corner a gamble between scavenged survival and sudden death.

[DOWNLOAD THE PACK HERE](https://www.patreon.com/posts/138784821)

40x30 | 100 ppi | Gridded &amp; Non-Gridded

Patrons can unlock all of the variants in this pack to jump right into the action. Discover more of my work on my [Patreon Map Archive](https://www.patreon.com/posts/map-database-132277939). Grab free versions of all my maps, no pledge required.

Station - Crime Scene - Clean - Night Vision - Dark - Wasteland - With &amp; Without Trains",Fallout2d20,2025-09-30T16:47:58,Reddit
Rust,Battlegrounds games should die already!,"I have 11k kills on heros and I took a break from those games for a year and I came back to see what was new I admit I was rust and had a skill issue on my end but after play the game for 3 months and brushing up on my skills I can say I am done with these games the only sweats on these games are headless emos, furrys, and femboys with 20-30k kills and they know every high damage or 100% combo and I am tired of sweating off 20 pounds just to win one fight and then they come running back because I damaged their ego then after we go back and fourth killing eachother till one of us gets a killstreak then leaves, I am tired of hanging on the edge my seat everytime I fight these no lifes and in all honest these games needs to die. PLEASE!",roblox,2025-09-30T16:44:54,Reddit
Rust,The Mystery of the PKR 2.85 Million Honda City: Why Buying a Used Car in Pakistan Is an Existential Crisis,"My Encounter with the $10,000 Time Capsule

I thought I was prepared for the chaos of Pakistan’s used car market, but then I stumbled upon the listing: a 2008 Honda City i-DSI Vario asking for a staggering PKR 2.85 million.
Let that number sink in. This is a 17-year-old car, being sold for nearly three times its original value. The seller’s justification, proudly listed on the ad? “First Owner” and, the Holy Grail of Pakistani car sales, “Genuine Paint.”
Intrigued, and slightly disturbed, I reached out. My offer was a generous PKR 2 million—still a high price for its age. The seller’s reaction wasn’t just a rejection; it was a digital sneer. He was genuinely offended, as if I had insulted his prized, appreciating asset. It was clear: the price was non-negotiable, fixed not by the car’s mechanical health, but by a superficial claim to its cosmetic history.
That interaction was a breaking point. It forced me to ask: What bizarre, upside-down logic governs used car pricing in this country?

The Bizarre Logic Behind Used Car Pricing (Where Up is Down)

The problem, as I quickly realised, runs far deeper than a single over-priced Honda. It’s a systemic delusion that warps the entire transaction.

1.	The Paint Job Doesn’t Make the Engine Go “Vroom”

Let’s address the obsession. In Pakistan, the paint condition is disproportionately valued. A car with “genuine paint”—meaning it has never been repainted—commands an instant, significant premium.
Why? Because any repaint is immediately flagged by buyers as evidence of a major accident, regardless of how minor the damage actually was. This creates a market where sellers prioritize the superficial over the mechanical. The car’s engine could be sputtering its last breath, the transmission could be slipping into oblivion, and the suspension could be shot—but if the original coat of factory paint is intact, the price is artificially inflated.
We are, essentially, collectively misled. We pay a premium for a shiny veneer while ignoring the vital, expensive components that actually determine a car’s longevity and performance.

2.	We Treat Cars as Assets, Not Liabilities

This is the real kicker. In a functioning economy, a car is a depreciating asset—it loses value the second you drive it off the lot. In Pakistan, cars are often treated as a legitimate financial investment.
This flawed mindset is driven by two things: a limited supply of new cars (thanks to high tariffs and low local production), and massive currency depreciation. People buy a car, believing it’s a safe place to park their money, expecting it to at least hold its value, if not appreciate.
This self-fulfilling prophecy means sellers feel justified in setting absurd prices. If a 17-year-old car is being sold for nearly three times its original cost, it’s not because of inflation; it’s because the entire market is gripped by the delusion that a used car is a better investment than the bank.

3.	The Dangerous Game of “Buyer Beware”

The underlying tragedy is the sheer lack of transparency. When a car is sold, the buyer has almost nothing to rely on besides the seller’s assurance that the car is “fine.”
There is no mandated, objective pre-sale inspection. A seller has zero incentive to disclose a costly problem like a failing head gasket or a shot gearbox. Why would they pay for a professional check that would only force them to lower their price? Buyers, lacking technical expertise, are forced to trust a seller looking to maximize profit, inevitably leading to people overpaying for cars that are far from “genuine” under the hood.

The Fix: How to Bring Sanity Back to the Dealership

After witnessing how completely broken the system is, the solution isn’t more negotiation; it’s systemic transparency and regulation. Here’s what needs to happen to level the playing field and stop the financial madness:

1.	A Government-Authorized Vehicle Inspection: The Mandatory Check-Up

The first, non-negotiable step is a standardized, government-mandated inspection for every used car listed for sale. This must go beyond basic registration renewal. The focus must be on mechanical health:

 * Engine &amp; Drivetrain: Performance, leakage, and overall mechanical condition.

 * Safety &amp; Structure: Suspension, brakes, tires, chassis integrity, and alignment.

 * Electronics &amp; Interior: Functionality of all dashboard components, climate control, and safety features.

 * Body Condition: Documenting dents, rust, and paintwork (but rating it realistically).

These inspections must be conducted at official, independent government-run or accredited facilities to prevent bias and corruption.

2.	A Standardized Vehicle Health Report and Rating System

Once inspected, the vehicle must be assigned a clear, comprehensive, and publicly available report card. This report would grade key components like, grade and detailed against each parameter.
Buyers could access this report instantly online via the car’s registration number. This single document would shift the power dynamic: the value would be based on facts, not seller anecdotes.

3.	Fair Pricing Tied to Objective Condition

With a standardized health report, an independent body (or the government itself) could establish a transparent price range for each car model based on its test results.
This would fundamentally break the “Genuine Paint” market manipulation. A car with perfect paint but a failing engine would be priced lower than a car with a few repainted panels but an engine in ‘Excellent’ condition. It would force sellers to invest in maintenance, not just cosmetics, and reward buyers with fair pricing.

4.	Cost Sharing for Transparency

The fee for this vital inspection must be reasonable (PKR 3,000–5,000) and structured to promote participation. The seller could pay the fee upfront to demonstrate confidence in their car’s condition, or the cost could be split between the buyer and seller upon transaction. Either way, the small cost of the inspection would be negligible compared to the thousands wasted on an unknown, faulty vehicle.

Conclusion: Time to Treat a Car Like a Car

The current used car market in Pakistan is a financial mess—defined by inflated prices, systemic lack of transparency, and a deeply flawed belief that a 17-year-old sedan is a sound investment.
By implementing a mandatory, standardized vehicle testing system and linking pricing to objective mechanical health, the government can finally introduce fairness and sanity. It’s time to stop paying fortunes for superficial bragging rights and start paying a fair price for a reliable vehicle. The market needs to change, and the key is simply making every sale transparent.


",PakistanAutoHub,2025-09-30T16:44:02,Reddit
Rust,"Rondo Ruut ST2 frameset – worth upgrading? Questions about weight, workmanship, and coating","Hi everyone,

I’m looking at the **Rondo Ruut ST2**, which is currently on sale for around €1,100. My idea would be to buy it as a complete bike and then upgrade it (e.g. Rival 1x12, Zipp 303).

Before I jump in, I’d like to ask specifically about the **frame itself**:

* Do you think this frame is worth upgrading, or should I just go for a higher-end steel frameset from the start?
* How does the **weight** of the Ruut ST2 frame + fork compare to other steel frames (e.g. Columbus, Dedacciai, etc.)?
* What’s your impression of the **workmanship** (welds, finishing, alignment)?
* Is the frame **ED coated** inside for rust protection, or is it just paint?

Thanks a lot for any first-hand experiences or insights!

— Soner",gravelcycling,2025-09-30T16:41:24,Reddit
Rust,"Telelog, a native Rust diagnostic library that generates execution flowcharts and also has first-class Python bindings.","https://preview.redd.it/bxo51zjq9asf1.png?width=500&amp;format=png&amp;auto=webp&amp;s=2eaeb7b905c01d694f35f8d7cc16292b3eabda85

Hey r/rust,

I built **Telelog**, a high-performance instrumentation library written in pure Rust, to help developers visualize their code's execution flow.

Instead of just reading text logs to understand program flow, Telelog generates **Mermaid.js diagrams** (like flowcharts and timelines) directly from your running code. It's designed for minimal overhead and provides an intuitive way to debug complex logic.

The core Rust crate offers:

* A simple API to **track components** and **profile code blocks**.
* The ability to generate **visual execution graphs** automatically.
* The performance and safety guarantees of Rust.

To make it accessible to a wider audience, I also used PyO3 to create a seamless Python wrapper. Now, developers in both ecosystems can get the full benefit of a native Rust core.

The project is fully open-source. I'd love to get your feedback, especially on the Rust API.

* **GitHub:** [`https://github.com/vedant-asati03/telelog`](https://github.com/vedant-asati03/telelog)
* **Crates.io:** [`https://crates.io/crates/telelog/0.1.0`](https://crates.io/crates/telelog/0.1.0)
* **PyPI:** [`https://pypi.org/project/telelog-python`](https://pypi.org/project/telelog-python)",rust,2025-09-30T16:28:45,Reddit
Rust,Is Rust the Beast for making mobile application that use 3D models and AI-Generation? (vs. C++),"Even though I've already seen a lot of hateful and unfavorable comments about Rust on YouTube, I still want to hear directly from the rust devs.  
I want to create a mobile application that makes use of 3D models and AI generation. Essentially, imagine using Blender on your phones (but not to the same extent as Blender).  
As you can see, I require quicker runtimes for machine learning models, effective 3D model generation, memory management, speed, backend, and security.  
I therefore researched and discovered that C++ and Rust are the two winning languages.  
Could someone please examine Rust's performance in the AI-ML and 3D model departments?  ",rust,2025-09-30T16:21:37,Reddit
Rust,new here! just wanted to show some progress pics,"hey all! wanted to show some progress on my legion kit that my wife and I purchased years ago, but never got around to painting everything until recently. the ships and buildings (obviously) are all printed, but the AT-ST and bikes were purchased. all that's left to finish are 2 buildings (i know one of them is not accurate to the location) and the bomber, then just need to find a good gaming mat to fit everything. everything is mostly airbrushed for the primers/base colors, then hand paints, rust powders and washes. used a cheap amazon airbrush and they actually are pretty good workhorses. was especially happy how the rancor and dewback turned out for my first attempt.

we have still yet to learn the gameplay, but I've watched several videos. there's a local brewery here that does paint and sips so we may try to finish the remainder at one of their events next week.",SWlegion,2025-09-30T16:15:29,Reddit
Rust,Felt a need to click a photo before I rushed it back home.,Let the engine running for a while to avoid water accumulation and rusting.,indianbikes,2025-09-30T16:10:45,Reddit
Rust,Grill BBQ recommendation,"I'm looking for a recommendation for a small gas grill...burgers and sausages kind of thing. Something that will last/not rust easily.

I ordered the Weber Spirit II E-210 on offer yesterday on Amazon for £309.60 to secure the offer.

Wondering if there is something better for &lt; £350 **because I can cancel the order/send it back**.

Any recommendations?",UKBBQ,2025-09-30T16:08:11,Reddit
