skill_query,title,description,source,publishedAt,platform
Java,Going Native With Android’s Native Development Kit,"Originally Android apps were only developed in Java, targeting the Dalvik Java Virtual Machine (JVM) and its associated environment. Compared to platforms like iOS with Objective-C, which is just C …read more",Hackaday,2025-09-15T14:00:41+00:00,NewsAPI
Java,Fernflower Java Decompiler,"Decompiler from Java bytecode to Java, used in IntelliJ IDEA. - JetBrains/fernflower",Github.com,2025-09-25T20:20:44+00:00,NewsAPI
Java,Omittable – Solving the Ambiguity of Null,"Null values in Java are used to present both the absence of a value and the default value of a reference type variable. To design robust APIs, it is necessary to unpack this semantic ambiguity. Omittable is a library solution to this problem.",Committing-crimes.com,2025-09-21T04:51:16+00:00,NewsAPI
Java,What Walmart's EVP of Global Tech companies looks for when hiring engineers,"Walmart EVP of Global Tech platforms Sravana Karnati has over 25 years of leadership experience, and he looks for two things when he hires engineers.",Business Insider,2025-09-29T09:08:01+00:00,NewsAPI
Java,"Three dead, dozens trapped after Indonesian school collapses on students",The rescue was temporarily halted on Tuesday as authorities say the building is at risk of further collapse.,BBC News,2025-09-30T09:22:04+00:00,NewsAPI
Java,Survivors pulled from collapsed school in Indonesia,An Islamic school collapsed during prayers in Indonesia&#039;s East Java. At least six people have been killed.,Al Jazeera English,2025-10-02T08:55:19+00:00,NewsAPI
Java,How 13-year-old Haikal survived Indonesia’s deadly boarding school collapse,Haikal survived for three days and two dark nights trapped beneath the rubble of his collapsed school in East Java.,Al Jazeera English,2025-10-03T09:10:25+00:00,NewsAPI
Java,EU age verification app not planning desktop support,"Hi I found multiple usability issues with this solution. The focus is so strong on the app, that it assumes everyone owns a smartphone. The other day I saw a granny on the bus with a phone that was...",Github.com,2025-09-24T11:52:50+00:00,NewsAPI
Java,"Basic Dialects, IDEs, and Tutorials","A curated list of awesome BASIC dialects, IDEs, and tutorials - JohnBlood/awesome-basic",Github.com,2025-10-01T05:22:06+00:00,NewsAPI
Java,"CodeSOD: Functionally, a Date","Dates are messy things, full of complicated edge cases and surprising ways for our assumptions to fail. They lack the pure mathematical beauty of other data types, like integers. But that absence doesn't mean we can't apply the beautiful, concise, and simple …",Thedailywtf.com,2025-09-15T06:30:00+00:00,NewsAPI
Java,Frantic rush to reach scores of students missing for days after boarding school collapse in Indonesia,Indonesian rescue teams are frantically searching for scores of young students buried for two days under concrete rubble after their Islamic boarding school ...,CNN,2025-10-01T05:15:28+00:00,NewsAPI
Java,Google's senior director of product explains how software engineering jobs are changing in the AI era,"With AI shifting the role of software engineers, Google's senior director of product says more developers will be involved in deploying products.",Business Insider,2025-09-23T14:10:01+00:00,NewsAPI
Java,The agentic internet is coming. AI companies are racing to build the digital rails first.,"Just as Google and Apple locked in developer ecosystems during the web and mobile eras, today's protocol pioneers may dominate the agentic future.",Business Insider,2025-09-26T16:48:00+00:00,NewsAPI
Java,"As a Texas local, I skip the crowds in Austin and head west to a charming nearby city with incredible wineries","I live in Texas, and love the small city of Fredericksburg. There's a lot to do there, from visiting wineries to eating at great restaurants downtown.",Business Insider,2025-09-30T17:02:02+00:00,NewsAPI
Java,OpenDataLoader-PDF: An open source tool for structured PDF parsing,"Safe, Open, High-Performance — PDF for AI. Contribute to opendataloader-project/opendataloader-pdf development by creating an account on GitHub.",Github.com,2025-09-23T13:58:48+00:00,NewsAPI
Java,Java 25 released,"Java 25 has been released. JDK 25, the reference implementation of Java 25, is now Generally Available. We shipped build 36 as the second Release Candidate of JDK 25 on 15 August, and no P1 bugs have been reported since then. Build 36 is therefore now the GA …",Osnews.com,2025-09-17T10:15:48+00:00,NewsAPI
Java,Daily Deal: The Ultimate Software Testing Bundle,Get the skills you need to become a software tester with the Ultimate Software Testing Bundle. Software testing is performed to identify differences between given input and expected output and to verify that software products function according to pre-defined…,Techdirt,2025-09-15T17:41:33+00:00,NewsAPI
Java,Disabling IPv6 in Java,"Java applications by default support both IPv4 and IPv6, depending on the underlying operating system and network configuration. In some environments, IPv6 may cause connectivity or compatibility issues, especially if your application or infrastructure is not…",Javacodegeeks.com,2025-10-01T09:17:27+00:00,NewsAPI
Java,Hogwarts Legacy And Every Other Game Added To Game Pass In The Big Shakeup,"Over 80 games have been added across various tiers of Game Pass with its big price hike
The post Hogwarts Legacy And Every Other Game Added To Game Pass In The Big Shakeup appeared first on Kotaku.",Kotaku,2025-10-01T15:09:26+00:00,NewsAPI
Java,A step-by-step guide to modernizing Java projects with GitHub Copilot agent mode,"Learn how to use GitHub Copilot agent mode to modernize legacy Java projects with guided upgrades, automated fixes, and cloud-ready migrations.
The post A step-by-step guide to modernizing Java projects with GitHub Copilot agent mode appeared first on The Git…",Github.blog,2025-09-22T21:46:08+00:00,NewsAPI
Java,"Indonesia School Collapse: Death Toll Rises to 36, Dozens Still Missing in East Java Tragedy","JAKARTA: The death toll from the collapse of an Islamic boarding school building in Indonesia’s East Java province has climbed to 36, up from 16 a day earlier, according to the country’s disaster mitigation agency on Sunday. Rescue teams have continued their search for a seventh consecutive day, working tirelessly to locate 27 students still [...]",dailytimes_pk,2025-10-05T06:37:34,NewsData
Java,"Indonesia school collapse: Death toll reaches 37, dozens still trapped under debris","Emergency teams are in a race against time, deploying sniffer dogs and heavy machinery to find those buried",firstpost,2025-10-05T06:31:36,NewsData
Java,Saving the Indus,"T he Indus Delta, a critical biodiversity hotspot and socio-economic hub, faces severe ecological degradation due to reduced freshwater flows and accelerating seawater intrusion.Ecological reports, including analyses of satellite imagery from 1972 to 2017, document alarming shoreline...",thenews,2025-10-05T06:16:34,NewsData
Java,"Odisha Gears Up for Holy Kartika Month: A Time of Faith, Fasting and Devotion","As the sacred month of Kartika approaches, Odisha is preparing for a time of deep spirituality, fasting, and devotion. Known as the holiest month in the Hindu calendar, Kartika is dedicated to Lord Vishnu and Lord Shiva, marking a period of faith, penance, and purity across the state. A Month That Transforms Odisha From brightly [...]The post Odisha Gears Up for Holy Kartika Month: A Time of Faith, Fasting and Devotion appeared first on Pragativadi I Latest Odisha News in English I Breaking News .",pragativadi,2025-10-05T06:02:04,NewsData
Java,"3 years after stadium disaster, Indonesia 2 wins away from return to World Cup","Almost 90 years after their first and only appearance at the World Cup, Indonesia are just two victories away from returning to the tournament.It would mark a major turnaround in fortunes in just over three years since 135 spectators died at the Kanjuruhan stadium disaster in East Java as tear gas fired by security forces caused a stampede for the exits on October 1, 2022, in a domestic match.If Indonesia can beat Saudi Arabia and Iraq on October 8 and 11, respectively, in the fourth round of...",scmp,2025-10-05T06:00:13,NewsData
Java,Death toll from Indonesia school collapse rises to 37,Part of the multi-storey building on Indonesia's Java island suddenly collapsed on Monday as students gathered for afternoon prayers.,ewn,2025-10-05T05:50:41,NewsData
Java,Central Java students develop smart lunch box to ensure free meal safety at school,The device earned the duo second place in a regional youth innovation competition.,straitstimes,2025-10-05T05:50:21,NewsData
Java,Death toll from Indonesia school collapse rises to 37; 26 still missing,"The recovery operation was around ""60 percent"" complete, national disaster agency official Budi Irawan told reporters, adding that he hoped it would be conclude",newindianexpress,2025-10-05T05:49:48,NewsData
Java,Barfresh Food Group (NASDAQ:BRFH) vs. Jammin Java (OTCMKTS:JAMN) Financial Survey,"Barfresh Food Group (NASDAQ:BRFH – Get Free Report) and Jammin Java (OTCMKTS:JAMN – Get Free Report) are both small-cap consumer staples companies, but which is the superior investment? We will compare the two companies based on the strength of their dividends, valuation, institutional ownership, risk, profitability, earnings and analyst recommendations. Analyst Ratings This is a [...]",defenseworld,2025-10-05T05:46:49,NewsData
Java,"Odisha gears up for holy Kartika month: A time of faith, fasting and devotion","As the auspicious month of Kartika draws near, Odisha readies itself for a period of deep spirituality, ritual observance, and cultural vibrancy. Known as the holiest month in the Hindu calendar, Kartika is dedicated to Lord Vishnu and Lord Shiva, and holds immense significance for devotees who observe strict religious vows, charity, and fasting during this sacred time.From temples adorned with lights to river ghats filled with the fragrance of incense and chants, the entire state transforms into a devotional landscape. For many Odias, Kartika is not merely a religious observance, it is a way of life that symbolises purity, faith, and the triumph of devotion over indulgence.When The Holy Month Begins...The month of Kartika usually falls between October and November, beginning the day after Laxmi Puja and concluding with Kartika Purnima, the full moon day. According to the Hindu calendar, it is considered the most auspicious month for worshipping Lord Vishnu and Lord Shiva.Devotees across Odisha adopt a vegetarian lifestyle during this period, refraining from non-vegetarian food. Many also opt out onions and garlic during the sacred month. Many people also undertake vows of celibacy and austerity, dedicating their days to prayer, cleanliness, and charity.Religious Significance And RitualsKartika is often described as the month of penance and devotion. Each Monday during this month holds special significance for devotees of Lord Shiva, who observe fasts and offer prayers at temples, especially the Lingaraj Temple in Bhubaneswar and Loknath Temple in Puri and Dhabaleswar in Cuttack.For Vaishnavites, the month is equally sacred as it honours Lord Vishnu. Temples like Jagannath Temple in Puri and Ananta Vasudeva Temple witness a surge of devotees during this time.Habisyalis: The Devout Widows Of KartikaOne of the most striking features of the Kartika observance in Odisha is the presence of Habisyalis, widowed women, who travel from across the state to Puri to lead a life of spiritual discipline for an entire month.They follow a strict routine, eating only once a day, a simple meal known as Habisa Anna, prepared without spices. They spend their days in prayer, visiting temples, and taking holy dips in sacred tanks like Narendra Pushkarini, Swetaganga, and Markandeya Pokhari.The Puri district administration and police make special arrangements every year for their accommodation and safety, with designated lodging centres and round-the-clock security.Also Read: Devotees to get free ‘Mahaprasad’ at Puri Jagannath temple soon: Odisha Law MinisterKartika Purnima: The Grand ConclusionThe holy month culminates with Kartika Purnima, the full moon day considered the most auspicious of all. On this day, devotees take early morning baths in rivers, ponds, or the sea and offer diyas (lamps) to the holy waters, symbolizing the triumph of light over darkness.The sight of tiny boats made of banana bark or paper, carrying lamps, flowers, and betel leaves, floating on the rivers and ponds at dawn is one of Odisha’s most beautiful spiritual spectacles.Bali Yatra: Remembering Odisha’s Maritime GloryKartika Purnima also marks the beginning of the famous Bali Yatra, celebrated in Cuttack. The festival commemorates the ancient maritime legacy of Odisha’s Sadhabas, traders and sailors, who once sailed to Southeast Asian countries like Bali, Java, and Sumatra for trade and cultural exchange.People float symbolic paper boats in memory of those voyages while the Bali Yatra fair, one of Asia’s largest open-air trade fair, lights up Cuttack city with cultural performances, food stalls, and traditional crafts.Also Read: Odisha’s ‘Bali Yatra’ to make historic debut in British Parliament this NovemberA Month of Faith and ReflectionKartika month, often called the ‘month of salvation’, blends faith, simplicity, and community spirit. Whether it’s the solemn discipline of the Habisyalis, the devotion of Monday fasts, or the joyous floating of boats on Kartika Purnima, the observance reflects Odisha’s enduring connection between spiritual devotion and cultural identity.As the lamps drift away on the water, they carry with them prayers for peace, purity, and prosperity, marking the end of one of Odisha’s most sacred and soul-stirring months.",odishatv,2025-10-05T05:18:08,NewsData
Java,Why Bloomberg Chose Vendor-Neutral Java Over Big Tech,,The New Stack,2025-10-06T00:17:30.875318,GoogleNews
Java,Bringing AI Inference to Java with ONNX: A Practical Guide for Enterprise Architects,,infoq.com,2025-10-06T00:17:30.876307,GoogleNews
Java,A step-by-step guide to modernizing Java projects with GitHub Copilot agent mode,,The GitHub Blog,2025-10-06T00:17:30.877195,GoogleNews
Java,Oracle Releases Java 25,,Oracle,2025-10-06T00:17:30.878097,GoogleNews
Java,ADK for Java opening up to third-party language models via LangChain4j integration,,Google for Developers Blog,2025-10-06T00:17:30.878957,GoogleNews
Java,JDK 26: The new features in Java 26,,InfoWorld,2025-10-06T00:17:30.879805,GoogleNews
Java,Minecraft Java Edition 1.21.9,,Minecraft,2025-10-06T00:17:30.880696,GoogleNews
Java,"The Netherlands returns 'Java Man,' thousands of colonial-era fossils taken from Indonesia",,CBC,2025-10-06T00:17:30.881541,GoogleNews
Java,Java Language Architect Brian Goetz on How Java Could Evolve,,The New Stack,2025-10-06T00:17:30.883742,GoogleNews
Java,GitHub Copilot app modernization is now generally available for Java and .NET - GitHub Changelog,,The GitHub Blog,2025-10-06T00:17:30.884714,GoogleNews
Java,Java Journeys: The Corner Brew,,WSKG,2025-10-06T00:17:30.885717,GoogleNews
Java,Why does the new furniture in Java Joe look like it’s on Ozempic?,,The Muhlenberg Weekly,2025-10-06T00:17:30.886623,GoogleNews
Java,Brian Fechino & The Risky Beavers make Jammin Java debut,,Fairfax Times,2025-10-06T00:17:30.887449,GoogleNews
Java,Indonesian rescuers search for missing students after school collapse kills 40,,Laredo Morning Times,2025-10-06T00:17:30.888304,GoogleNews
Java,The Java Developer’s Dilemma: Part 1,,O'Reilly Media,2025-10-06T00:17:30.889115,GoogleNews
Java,Java at 30 and beyond: How IBM is Securing the future of Java,,IBM,2025-10-06T00:17:30.889956,GoogleNews
Java,Death toll from Indonesia school collapse rises to 14 as more victims found,,Al Jazeera,2025-10-06T00:17:30.890760,GoogleNews
Java,Death toll rises to 13 as rescuers search for trapped Indonesian students,,Reuters,2025-10-06T00:17:30.891572,GoogleNews
Java,Death toll from Indonesia school collapse rises to 45,,The Mountaineer,2025-10-06T00:17:30.892420,GoogleNews
Java,Strong Java LTS arrives with the release of 25,,theregister.com,2025-10-06T00:17:30.893210,GoogleNews
Java,Tired of Geyser servers always putting Java first? Check out the Realm of Aureus!,"# Welcome to the Realm of Aureus!

**[NOTE: We are a *server*, NOT an actual realm!]**

Are you looking for a long-term adventure? A unique community you can call home, with no resets? Look no further! 

The Realm of Aureus combines the open-world survival and exploration aspect of vanilla Minecraft with the deep lore feel of an RPG. Our players are encouraged to build their bases, make friends, and strive to complete the most difficult tasks we have to offer. We can confidently boast over 500+ unique items, armors, enchantments, tools, skills, bosses, creatures and NPCs to explore and experiment with, all made in-house with an unmatched level of care and quality.

The community drives our development priorities. We have a limitless well of ideas and content to release, but we will always prioritize community requests.

# What we can offer:

**Unique Bosses and Dungeons** \- Fight bosses throughout the Realm! Use the terrain to your advantage, utilize boss weaknesses, and enjoy an exhilarating challenge as you fight through powerful foes to claim their hordes of loot!

**World Border** \- Explore out to a world border that expands by 1,000 blocks every Age. With an ever-expanding border, there is always fresh space to build on!

**Java/Bedrock Parity** \- Running on Geyser, we have done extensive testing and resource pack engineering to get all our textures and assets to be visually at one with both clients to the current capabilities of modern Minecraft. Share a cosmetic hat with your friends on both Bedrock and Java!

**Territory Protection** \- Protect your bases and builds from destruction with our easy to use land protection! Guard your territory, ally with other towns, and even form nations of smaller cities!

**Achievement Hunting** \- Complete over 400 special achievements with a varying range of difficulty; from locating a rare piece of gear, to unlocking a unique chat title, or slaying a powerful boss - the more achievements you complete, the higher your fame progresses!

**Leaderboards** \- A fan favorite, there are leaderboards and stat trackers for all 400+ achievements in the game. Everything you achieve can be easily viewed in your achievement book!

**Unique Cosmetics** \- Wear a hat, a santa suit, or even a pair of colored wings! You name it, we have it.

**Community Voting** \- Vote in community polls to drive our content design. You can also post your own suggestions for people to vote on!

**Experienced Staff Team** \- Our staff team is small, passionate, and always willing to assist you. With nearly round-the-clock support, you can ensure that issues are met with the utmost urgency.

**Non-P2W** \- Most importantly, we offer only a single paid status, called Membership. This grants you access to all our bonus features and extra goodies and helps support our growing community costs in a sustainable and consumer friendly method.

Version - **1.21.7 - 1.21.8**

IP - **play.aureusmc.net**

Bedrock Port - **19132**

Discord - **[https://discord.gg/rqsqNRK5U5](https://discord.gg/rqsqNRK5U5)**

**What are you waiting for?!** *Come join our community today!*",MinecraftBedrockers,2025-10-06T00:08:01,Reddit
Java,Wish Attack 5,"Liebe Minecraft Spieler, der Craft Attack Hype kommt so langsam auf und somit startet auch Wish Attack, bereits in der 5. Staffel.

Das Projekt startet am **10. Oktober 2025** um **18:00 Uhr** in der Minecraft Version 1.21.9+.

Achtung: Nur Java

**Mit den geliebten Craft Attack Features:**

\- Spawn Elytra

\- Simple Voice Chat

\- Custom Armorstands

\- Mob &amp; Playerheads

\- Playertags (Suffix)

\- Rezept für Lichtblöcke &amp; unsichtbare Itemframes

\- &amp; dieses Jahr neu: /pvp

! Um dem Craft Attack Feeling so nah wie möglich zu kommen \*\*verzichten\*\* wir bewusst auf Features wie TPA, Homes oder gar Creative Shops.

Egal ob ihr euch kreativ beim Bauen austoben wollt, oder lieber gegen andere Spieler kämpft, bei uns ist's möglich. In einer Community mit fast 500 Spielern seid ihr herzlich Willkommen und habt die Chance, neue Freundschaften zu schließen!

**Interesse?**

Joint unserem Discord und lasst euch whitelisten!

[https://discord.gg/jyHfjYuP7u](https://discord.gg/jyHfjYuP7u)

Wir freuen uns auf euch!

https://preview.redd.it/pgbmayyt7ctf1.jpg?width=1920&amp;format=pjpg&amp;auto=webp&amp;s=8acc9d85b619ea15893cf993f94a5cd51002e2ed",MinecraftDe,2025-10-06T00:06:44,Reddit
Java,Stonehaven SMP {Vanilla} {QoL Mods} {Protected Builds} {Java 1.21.8},"Hey everyone.

I have hosted my server publicly this Monday 29th September (fresh start) and have gathered a few ppl from Reddit as well who each play on their own pace and all are friendly. Activity on server varies though depending on time zones.

Server is running on Minecraft 1.21.8 Fabric with only few mods for QoL purposes and terrain/structures revamp. Main mods include:  
*- In-game voice chat*  
*- Land Claiming for worry-free building*  
*- In-game chat integrated with Discord*  
*- Revamped Nether/End/villages/structures/strongholds/mansions/temples etc.*  
*- Falling Tree to one-shot the entire tree when cutting.*

Depending on players' demands we can add more mods.

Nether opened Wednesday 1st October and End opened Saturday 4th October.

Main server concept is to be a chill and welcoming environment.

So either you wanna just chill and build alone or with others, or wanna speed run you are most welcome.

**For more info and how to connect add  me on Disc: stargazer\_tdk or send me a DM here** :D",MinecraftServer,2025-10-06T00:06:13,Reddit
Java,Ordinary SMP [Vanilla] {Java 1.21.8} {Fabric} {Hermitcraft-like} {Whitelist},"**[ORDINARY SMP]** - Vanilla | Java 1.21.8 | Whitelisted

Hey Crafters!

Ordinary SMP is a tight-knit, active community where players from around the world come together to build, explore &amp; have fun. Whether you are starting fresh or looking for your next Minecraft home, you're welcome here!

**What Makes Us Special?**
- Version: Always up to date. We are on **1.21.8** with all the latest features.
- Tight-Knit &amp; Friendly Community: Join a diverse group of players who love to build &amp; collaborate on exciting community projects.
- Grief Protection: Even though we’re a vanilla SMP, we’ve got safeguards in place to keep your builds safe and secure from any troublemakers.

**Exciting Features!**
- [BlueMap](https://map.ordinary-smp.com/): Navigate the world with an interactive live map.
- AudioPlayer: Custom audio 
- Simple VoiceChat: Enhance your immersion and chat with fellow players in game.
- Dragon Elytra Drops
- Custom Resource Pack: Our server features a unique custom resource pack with exclusive cosmetics, trophies &amp; event rewards that match our HermitCraft-inspired theme. Have an idea for custom items? We’d love to hear it!

**Why Should You Join Us?**
- Server-Wide Events: PvP battles, build contests &amp; massive community projects. There’s always something fun going on!
- We’re whitelisted to ensure a respectful and fun player base.
- Whether you're a master builder, an explorer, a redstone engineer or just here to vibe, you'll fit right in.

**How to Join?**
You can join us here on Discord: https://discord.gg/GjmY3mECSX

Come join us and be a part of something amazing. We can’t wait to see what Ordinary SMP will become with you in it.

See you in the Ordinary SMP.",MinecraftServerFinder,2025-10-06T00:04:55,Reddit
Java,Ordinary SMP [Vanilla] {Java 1.21.8} {Fabric} {Hermitcraft-like} {Whitelist},"**[ORDINARY SMP]** - Vanilla | Java 1.21.8 | Whitelisted

Hey Crafters!

Ordinary SMP is a tight-knit, active community where players from around the world come together to build, explore &amp; have fun. Whether you are starting fresh or looking for your next Minecraft home, you're welcome here!

**What Makes Us Special?**
- Version: Always up to date. We are on **1.21.8** with all the latest features.
- Tight-Knit &amp; Friendly Community: Join a diverse group of players who love to build &amp; collaborate on exciting community projects.
- Grief Protection: Even though we’re a vanilla SMP, we’ve got safeguards in place to keep your builds safe and secure from any troublemakers.

**Exciting Features!**
- [BlueMap](https://map.ordinary-smp.com/): Navigate the world with an interactive live map.
- AudioPlayer: Custom audio 
- Simple VoiceChat: Enhance your immersion and chat with fellow players in game.
- Dragon Elytra Drops
- Custom Resource Pack: Our server features a unique custom resource pack with exclusive cosmetics, trophies &amp; event rewards that match our HermitCraft-inspired theme. Have an idea for custom items? We’d love to hear it!

**Why Should You Join Us?**
- Server-Wide Events: PvP battles, build contests &amp; massive community projects. There’s always something fun going on!
- We’re whitelisted to ensure a respectful and fun player base.
- Whether you're a master builder, an explorer, a redstone engineer or just here to vibe, you'll fit right in.

**How to Join?**
You can join us here on Discord: https://discord.gg/GjmY3mECSX

Come join us and be a part of something amazing. We can’t wait to see what Ordinary SMP will become with you in it.

See you in the Ordinary SMP.",MinecraftServer,2025-10-06T00:04:49,Reddit
