skill_query,title,description,source,publishedAt,platform
Python,Where should I ED?,"Stats:GPA: 3.6 (3.4, 3.4, 4.0)

SAT: 1520

Extracurriculars:

– Authored an independent research, on fuel optimization strategies for an airline (preprinted and submitted for a journal)

– Co-developed an app that helped students study (utilizing AI greatly, related to how the national exam pass rate is &lt;5%) (won 1st at school and regional science fair, competed at capital city level)

–Developed a health-care companion app (also slightly utilizing AI) (won 1st at school, 3rd at regional science fair)

–Developed a low cost fire detector (1st at school, 2nd at regional science fair)

–Found the MUN club at my school, and is it's president

–Python and drone pilot training summer camps

–Some courses on Coursera (related to AE)

–Started and lead a community at my school that helped students apply to unis (&gt;50% of batch are members)

–A lot of blogging related to AE, Ethiopia and Ethiopian Airlines

Uni list: 
Princeton University 
Case Western Reserve University
Cornell University
Florida Institute of Technology
Harvey Mudd College
Illinois Institute of Technology
Lafayette College
New Jersey Institute of Technology
Northwestern University
Purdue University
Rice University
Santa Clara University
Stanford University
Temple University
The University of Alabama in Huntsville
University of Central Florida
University of Houston
University of Miami
University of Minnesota Twin Cities
Wichita State University


*I need the uni to be atleast a t30 (or close), and thanks for reading! 
",ApplyingToCollege,2025-10-06T00:00:19,Reddit
Python,Not Getting Selected - looking for Internship or Job,,FresherTechJobsIndia,2025-10-05T23:58:06,Reddit
Python,mon parcours post etudes,"En 2020 , après la pandémie du covid , je termine mon DUT informatique.

J'oublie les dates de candidatures sur la plateforme E candidat.

Je prend une annee sabbatique, je me met à parler à des oies.

En 2021, je passe des entretiens et je finis par etre admis dans une licence PRO en data.

La seule chose qu'on me demande en entretien est ce que tu sais faire du SQL et je dis que OUI.

Voilà ou tout commence.

Je trouve une alternance dans la fonction publique, je pensais à l'époque que l'importance c'est d'en avoir une que pas du tout et c'est tout. je suis data analyste qlik sense.

Je continu en master, je trouve une alternance dans une ETI avec les outils pentaho data integrator et power bi , la fiche de poste c'était écrit data scientist notamment avec du python. En faite c'est plus développeur BI.

J'apprends après mes études que ce qui compte ce sont les outils et le nom de l'entreprise qui compte pour avoir un JOB .

Je fais des entretiens, on me propose :

De faire du run avec un gars qui me claque des doigts quand je réfléchi et le but c'est juste donner des droits utilisateurs et faire de la documentation.

On me propose un autre job avec un statut de technicien payé 1750 net pour faire de le data scientist sur des fichiers excel.

Je dois sonner à un interphone pour rentrer dans les bureaux, j'ai pas de badge pour rentrer.

Faire le tour des bureaux et ouvrir la porte du patron chaque matin et chaque soir.

Signer une feuille comme quoi tu renonces à tes congés liés aux non fractionnements des congés.

Depuis peu, on m'a proposé un job à 1450 net apres impot en CDD de 5 mois pour faire du support niveau 1.",emploi,2025-10-05T23:55:11,Reddit
Python,What are you thoughts on this laptop for linux?,"[https://www.lenovo.com/us/en/p/laptops/thinkpad/thinkpadp/thinkpad-p16s-gen-4-16-inch-amd-mobile-workstation/21rxcto1wwus1](https://www.lenovo.com/us/en/p/laptops/thinkpad/thinkpadp/thinkpad-p16s-gen-4-16-inch-amd-mobile-workstation/21rxcto1wwus1)

I will be mostly using it for 3D modeling and 3D printing in fusion360, coding in c++, python, cybersecurity, and graphics programming in opengl.

",pcmasterrace,2025-10-05T23:51:05,Reddit
Python,What are you thoughts on this laptop for linux?,"[https://www.lenovo.com/us/en/p/laptops/thinkpad/thinkpadp/thinkpad-p16s-gen-4-16-inch-amd-mobile-workstation/21rxcto1wwus1](https://www.lenovo.com/us/en/p/laptops/thinkpad/thinkpadp/thinkpad-p16s-gen-4-16-inch-amd-mobile-workstation/21rxcto1wwus1)

I will be mostly using it for 3D modeling and 3D printing in fusion360, coding in c++, python, cybersecurity, and graphics programming in opengl.

",linuxhardware,2025-10-05T23:50:40,Reddit
Python,"First-year physics undergrad (GTÜ) wants a plasma physics project—how do I pick a topic, what should I learn first, and where can I get help?","Hi all! I’m a first-year physics student at **Gebze Technical University**. I want to start a **plasma physics** project (either experimental or simulation) and I’m not sure how to choose a good, realistic topic for my level.

**What I’m aiming for**

* Teaches me real plasma skills (diagnostics, basic modeling, or data analysis)
* Safe + affordable (student budget), or purely computational

**My background**

* Math: Calc I–II, basic linear algebra/ODEs
* Physics: intro mechanics + EM in progress
* Coding: Python (NumPy/Matplotlib), a bit of MATLAB
* Tools access: basic electronics bench at school; I can probably get lab time if I find a supervisor

**Constraints**

* Budget is limited; I can buy a few components or spend time learning open-source codes
* I can commit \~8–10 hrs/week this term

Thanks a lot for any pointers! If you need more info about what’s available at my department, I can ask around and share details.",Physics,2025-10-05T23:49:24,Reddit
Python,Breaking into Quant,"What’s up everyone. This might come off random but I am just thinking out loud at this point and wanted to hear from anyone in the quant world. I have a passion for technology and I recently have become very interested in Quant. 

I am 31 and I live in Cali. have no professional experience in quant for I have just started diving deep with theory and concepts. I have some experience with Python but in the grand scheme of things I know I am a novice. I want to make this a career for myself and make a change. I know I truly am late to the game but I am someone who has passion and truly will do anything I can to grow and learn everything I can to know the deep knowledge of quant. I want to mainly make my way into being a Quant Trader. 

I am currently doing self studies. Statistics, probability. Books. Hands on application with python and trying to get an idea of the space. My main reality is I know I’m getting older, or “old” in the space of quant. But to be real, I am changing careers no matter what so this is what I want to do. I keep seeing degrees are an absolute must. I have only gone to college for 3 semesters and majored in Kinesiology so, completely different. 

Forgive me for babbling on but I want to know if it’s essentially too late. I know things aren’t always as black and white. Successful alphas. Being able to convey what I have learned and continuing to grow, I want to compete. 

My main ask is do you think I am able to break into the space at the age of 34 ish after I receive a bachelors. Or if a bachelors is truly needed to be with a larger firm or even a smaller firm. I know the filters, the doing self studies path and even while applying to jobs you are immediately rejected due to the lack of a degree for the hr filters.

Could I learn and grow on my own and learn the ins and out of the trade and truly understand the math behind these decisions. Of course I am leaning towards self studies but I know this isn’t like cybersecurity (which I have less than 6 months experience in) where you can get a cert and employers know you know the standard for security. But with quant it’s a different animal. 

Long story short, would the best route to get a bachelors in computer science and then continue or is it even possible for me to prove alpha and studies and knowledge to where I can start growing on my own and still get hired by providing proof of knowledge with projects and anything else that I need. Thanks for all your help in advance, I know it’s a lengthy entry. I appreciate all of you, thank you! ",quantfinance,2025-10-05T23:48:46,Reddit
Python,Computer Science &amp; IT Projects,"Computer Science &amp; IT Projects

Need help with Python, Java, SQL, or coding reports?
I handle CS assignments, including code debugging, documentation, UI design, and database tasks.

📧 universalwriters43@gmail.com | 📱 WhatsApp: +44 7925 425582",AssignmentEssay_Help,2025-10-05T23:48:30,Reddit
Python,I built an AI with an AI - and it actually works. Here's how it went!,"Tldr: I used [Zo](https://www.zo.computer/) (using 4.5 sonnet as the LLM backend) to build an implementation of the [LIDA](https://en.wikipedia.org/wiki/LIDA_(cognitive_architecture)) cognitive architecture as an end-to-end stress test, and it was the first LLM tool I've seen deliver a complete and working implementation. Here's the repo to [prove](https://github.com/mindpixel20/lida) it!

Long version: A few days ago, I came across [zo.computer](http://zo.computer/) and wanted to give it a try - what stood out to me was that it comes with a full-fledged linux VPS you've got total control over, in addition to workflows similar to Claude Pro. Naturally I wanted to use 4.5 Sonnet since it's always been my go-to for heavy coding work (there's a working FLOW-MATIC interpreter on my github I built with Claude btw). I like to run big coding projects to judge the quality of the tool and quickly find its limitations. Claude on its own, for instance, wasn't able to build up [Ikon Flux](http://cadia.ru.is/wiki/_media/public:publications:ikonfluxrutrcs07006.pdf) (another cognitive architecture) - it kept getting stuck in abstract concepts like saliences/pregnance in IF context. I figured LIDA would've been a reasonable but still large codebase to tackle with Zo + 4.5 sonnet.

The workflow itself was pretty interesting. After I got set up, I told Zo to research what LIDA was. Web search and browse tools were already built in, so it had no trouble getting up to speed. What I think worked best was prompting it to list out step by step what it'll need to do, and make a file with its ""big picture"" plan. After we got the plan down, I told it ""Okay, start at step 1, begin full implementation"" and off it went. It used the VM heavily to get a python environment up and running, organize the codebase's structure, and it even wrote out tests to verify each step was completed and functions as it should. Sometimes it'd struggle on code that didn't have an immediate fix; but telling it to consider alternatives usually got it back on track. It'd also stop and have me run the development stage's code on the VM to see for myself that it was working, which was neat!

So, for the next four or five-ish hours, this was the development loop. It felt much more collaborative than the other tools I've used so far, and honestly due to built-in file management AND a VM both me and Zo/Claude could use, it felt MUCH more productive. Less human error, more context for the LLM to work with, etc. Believe it or not, all of this was accomplished from a single Zo chat too.

I honestly think Zo's capabilities set it apart from competitors - but that's just me. I'd love to hear your opinions about it, since it's still pretty new. But the fact I built an AI with an AI is freakin' huge either way!!   
",AIToolTesting,2025-10-05T23:46:49,Reddit
Python,Stripe Bug squash round,"Hello, I have my Stripe bug squash round next week. I chose python. I have no idea what kind of repo they give and how to practice. Please help me to practice for this round. Your insights would be great help.",SoftwareEngineerJobs,2025-10-05T23:44:21,Reddit
Python,Resources for Green Tree Pythons that arent by people who shove their snakes in tiny barren enclosures?,"It seems like most of the ""experts"" on GTP shove their snake in an enclosure thats clearly not big enough with no enrichment and paper towels as the substrate.... I don't see how that isn't abuse",snakes,2025-10-05T23:44:01,Reddit
Python,Stripe bug squash round,"Hello, I have my Stripe bug squash round next week. I chose python. I have no idea what kind of repo they give and how to practice. Please help me to practice for this round. Your insights would be great help.",interviews,2025-10-05T23:42:17,Reddit
Python,Stripe Bug Squash round,"Hello, I have my Stripe bug squash round next week. I chose python. I have no idea what kind of repo they give and how to practice. Please help me to practice for this round. Your insights would be great help.",interviewpreparations,2025-10-05T23:41:42,Reddit
Python,How to help cc understand private library APIs without bloating the context window?,"Hey r/ClaudeAI 

I'm integrating cc into my dev workflow and running into a common bottleneck: how to give it accurate context for private libraries (in separate git repos) my app depends on (custom classes, async patterns, internal helpers, etc.).

Feeding the full codebase of all private libraries into prompts isn't realistic - it quickly blows past token limits, and cc starts hallucinating once context gets fuzzy.

What I've tried so far:

- Pasting snippets + doc comments: Works for small cases, but scales horribly - messy and eats up tokens fast. 
- Linking a Markdown summary: Often ignored or inconsistently used.
- Prompt boilerplates: Fine for basic functions, but breaks down for complex APIs and async workflows. 

What I actually need: A low-token, lightweight method for cc to reliably recall the correct methods, parameters, and edge cases (e.g. `LibraryClient.authenticate_with_retry()`) without hallucinating or guessing.

Ideas I'm exploring:
- RAG / local vector store 
- JSON “cheat sheet” with key methods
- Local MCP servers for API metadata 

How are you managing private library APIs with cc? What's working for you in terms of tools, prompt design, or local context injection - ideally setups that run offline and don't require a GPU? 

would love to hear real-world experiences or lightweight solutions you've built.

btw. I am working with Python, TypeScript, Java and Dart

thanks!!",ClaudeCode,2025-10-05T23:40:16,Reddit
JavaScript,Icebird: JavaScript Iceberg Reader,Icebird: JavaScript Iceberg Client. Contribute to hyparam/icebird development by creating an account on GitHub.,Github.com,2025-10-01T10:11:02+00:00,NewsAPI
JavaScript,The JavaScript Handbook (2025 edition),The JavaScript Handbook (2025 edition),Flaviocopes.com,2025-09-29T10:43:41+00:00,NewsAPI
JavaScript,Checking if a JavaScript native function is monkey patched (2022),"Delving deep into how to determine whether a JavaScript native function has been monkey patched, and why it's not possible to determine it reliably.",Mmazzarolo.com,2025-09-08T18:57:36+00:00,NewsAPI
JavaScript,Storing Unwise Amounts of Data in JavaScript Bigints,"Storing Unwise Amounts of Data in JavaScript Bigints This is a short note to document storing data in JS’s bigint type. I tried this out in a project recently, and it’s not obviously a terrible idea, as long as you take into account all the caveats that make …",Jonathan-frere.com,2025-09-21T18:58:51+00:00,NewsAPI
JavaScript,"Pong Wars: A battle between day and night, good and bad","It's the eternal battle between day and night, good and bad. Written in JavaScript with some HTML & CSS in one index.html. - vnglst/pong-wars",Github.com,2025-09-29T13:44:02+00:00,NewsAPI
JavaScript,Visual loading states for Turbo Frames with CSS only,Learn how to add instant loading feedback to your Turbo Frames without JavaScript. I'll walk you through using the aria-busy state with CSS pseudo-elements to show text or animated SVG spinners during slow requests.,Railsdesigner.com,2025-10-02T12:46:31+00:00,NewsAPI
JavaScript,Apple Releases Safari Technology Preview 228 With Bug Fixes and Performance Improvements,"Apple today released a new update for Safari Technology Preview, the experimental browser that was first introduced in March 2016. Apple designed ‌Safari Technology Preview‌ to allow users to test features that are planned for future release versions of the S…",MacRumors,2025-09-17T21:47:56+00:00,NewsAPI
JavaScript,Ladybird Browser Gains Cloudflare Support to Challenge the Status Quo,"An anonymous reader shared this report from the blog Linuxiac:


In a somewhat unexpected move, Cloudflare has announced its sponsorship of the Ladybird browser, an independent (still-in-development) open-source initiative aimed at developing a modern, standa…",Slashdot.org,2025-09-29T07:44:00+00:00,NewsAPI
JavaScript,Daily Deal: The JavaScript DOM Game Developer Bundle,"The JavaScript DOM Game Developer Bundle has 8 courses to help you master coding fundamentals. Courses cover JavaScript DOM, Coding, HTML 5 Canvas, and more. You’ll learn how to create your own fun, interactive games. It’s on sale for $30. Note: The Techdirt …",Techdirt,2025-09-04T17:40:00+00:00,NewsAPI
JavaScript,Amazon accidentally confirms Vega TV OS launch for 2025,"This is Lowpass by Janko Roettgers, a newsletter on the ever-evolving intersection of tech and entertainment, syndicated just for The Verge subscribers once a week. Amazon is moving ahead with plans to replace Android with its custom-built Vega operating syst…",The Verge,2025-09-25T12:02:11+00:00,NewsAPI
JavaScript,Daily Deal: The Learn to Code with React Bundle,"The Learn to Code with React Bundle has 9 courses to help you learn more about React, Redux, and JavaScript. Used by the likes of Instagram, Facebook, Netflix, and Imgur, React is an efficient and flexible JavaScript library for building user interfaces. Mean…",Techdirt,2025-09-26T17:47:00+00:00,NewsAPI
JavaScript,"From MCP to shell: MCP auth flaws enable RCE in Claude Code, Gemini CLI and more","How MCP Authentication Flaws Enable RCE in Claude Code, Gemini CLI, and More",Verialabs.com,2025-09-23T15:09:50+00:00,NewsAPI
JavaScript,Minimal files and config for a PWA (including a single file PWA),Minimal files + config for a PWA. Contribute to chr15m/minimal-pwa development by creating an account on GitHub.,Github.com,2025-10-01T13:14:48+00:00,NewsAPI
JavaScript,8 Autumn-Inspired CSS & JavaScript Effects,"The colors and flavors of Autumn offer plenty of design inspiration. The innovative CSS and JavaScript snippets here will allow you to explore the season and sharpen your skills.
The post 8 Autumn-Inspired CSS & JavaScript Effects appeared first on Speckyboy …",Speckyboy.com,2025-09-08T13:14:36+00:00,NewsAPI
JavaScript,Which NPM package has the largest version number?,I spent way too much time on this,Adamhl.dev,2025-09-15T03:03:18+00:00,NewsAPI
JavaScript,Creating Elastic And Bounce Effects With Expressive Animator,"Elastic and bounce effects have long been among the most desirable but time-consuming techniques in motion design. Expressive Animator streamlines the process, making it possible to produce lively animations in seconds, bypassing the tedious work of manual ke…",Smashingmagazine.com,2025-09-15T10:00:00+00:00,NewsAPI
JavaScript,Ollama Web search,"A new web search API is now available in Ollama. Ollama provides a generous free tier of web searches for individuals to use, and higher rate limits are available via Ollama’s cloud.",Ollama.com,2025-09-25T19:21:52+00:00,NewsAPI
JavaScript,CodeSOD: An Echo In Here in here,"Tobbi sends us a true confession: they wrote this code.
The code we're about to look at is the kind of code that mixes JavaScript and PHP together, using PHP to generate JavaScript code. That's already a terrible anti-pattern, but Tobbi adds another layer to …",Thedailywtf.com,2025-09-18T06:30:00+00:00,NewsAPI
JavaScript,Self-Replicating Worm Hits 180+ Software Packages,"At least 187 code packages made available through the JavaScript repository NPM have been infected with a self-replicating worm that steals credentials from developers and publishes those secrets on GitHub, experts warn. The malware, which briefly infected mu…",Krebs on Security,2025-09-16T14:08:02+00:00,NewsAPI
JavaScript,We All Dodged a Bullet,That NPM attack could have been so much worse.,Xeiaso.net,2025-09-09T15:11:26+00:00,NewsAPI
JavaScript,Progress Software (NASDAQ:PRGS) Upgraded by Wall Street Zen to Buy Rating,Progress Software (NASDAQ:PRGS – Get Free Report) was upgraded by investment analysts at Wall Street Zen from a “hold” rating to a “buy” rating in a report released on Friday. PRGS has been the subject of a number of other research reports. DA Davidson reissued a “buy” rating and set a $75.00 target price on [...],americanbankingnews,2025-10-05T06:18:53,NewsData
JavaScript,Progress Software (NASDAQ:PRGS) Raised to Buy at Wall Street Zen,Progress Software (NASDAQ:PRGS – Get Free Report) was upgraded by investment analysts at Wall Street Zen from a “hold” rating to a “buy” rating in a report released on Friday. PRGS has been the subject of several other research reports. Wedbush reissued an “outperform” rating and set a $75.00 price target on shares of Progress [...],defenseworld,2025-10-05T06:18:53,NewsData
JavaScript,"After early deficit, Duke puts away Cal with 38-point run","Darian Mensah passed for 265 yards and two touchdowns and Duke scored the game's final 38 points to post a 45-21 victory over Cal on Saturday night in Atlantic Coast Conference play at Berkeley, Calif.",henryherald,2025-10-05T06:14:36,NewsData
JavaScript,"Duke 45, California 21",,caledonianrecord,2025-10-05T06:08:07,NewsData
JavaScript,Jays ask rookie RHP Trey Yesavage to tame Yanks in Game 2,"TORONTO -- The Toronto Blue Jays could have entrusted Game 2 to Hall of Fame-bound Max Scherzer or Chris Basssitt, a pair of accomplished right-handers who have 304 regular-season and eight postseason wins between them.",henryherald,2025-10-05T06:02:51,NewsData
JavaScript,"Fresno St. 20, Nevada 17",,enidnews,2025-10-05T05:49:48,NewsData
JavaScript,"Fresno St. 20, Nevada 17",,caledonianrecord,2025-10-05T05:49:48,NewsData
JavaScript,MLB roundup: Tigers top Mariners in 11 innings to take series opener,Zach McKinstry's broken-bat RBI single with two outs in the top of the 11th inning broke a tie as the Detroit Tigers defeated host Seattle Mariners 3-2 on Saturday night in the opener of their best-of-five American League Division Series.,henryherald,2025-10-05T05:42:17,NewsData
JavaScript,Report: Napheesa Collier cancels meeting with WNBA commissioner,"The relationship between WNBA star forward Napheesa Collier and league commissioner Cathy Engelbert apparently hit another setback, with the player canceling a meeting scheduled for next week, ESPN reported on Saturday.",henryherald,2025-10-05T05:41:32,NewsData
JavaScript,How the German government is going all in on AI,"Chancellor Friedrich Merz’s cabinet agreed on a ""modernization agenda"" this week, which includes the use of AI. Critics have questioned how much of this is in the public interest.",dw,2025-10-05T05:41:00,NewsData
JavaScript,The JavaScript code won’t write itself,,InfoWorld,2025-10-06T00:18:12.049642,GoogleNews
JavaScript,Classic Snake game now playable in your browser URL address bar — JavaScript remake uses Unicode Braille characters to render the game,,Tom's Hardware,2025-10-06T00:18:12.050079,GoogleNews
JavaScript,Cap'n Web: A new RPC system for browsers and web servers,,The Cloudflare Blog,2025-10-06T00:18:12.050462,GoogleNews
JavaScript,From Python to JavaScript: A Playbook for Data Analytics in n8n with Code Node Examples,,Towards Data Science,2025-10-06T00:18:12.050788,GoogleNews
JavaScript,Crypto users urged to take extreme care as NPM attack hits core JavaScript libraries,,Cointelegraph,2025-10-06T00:18:12.051092,GoogleNews
JavaScript,NPM Attack: Javascript Library Compromise Goes After Bitcoin Wallets,,Bitcoin Magazine,2025-10-06T00:18:12.051388,GoogleNews
JavaScript,"JavaScript packages with billions of downloads were injected with malicious code in world's largest supply chain hack, geared to steal crypto — a phishing email is all it took to undermine npm packages",,Tom's Hardware,2025-10-06T00:18:12.051709,GoogleNews
JavaScript,How WebMCP Lets Developers Control AI Agents With JavaScript,,The New Stack,2025-10-06T00:18:12.051935,GoogleNews
JavaScript,Multiple Splunk Enterprise Vulnerabilities Let Attackers Execute Unauthorized JavaScript code,,Cyber Security News,2025-10-06T00:18:12.052150,GoogleNews
JavaScript,Splunk Enterprise Flaws Allow Attackers to Run Unauthorized JavaScript Code,,gbhackers.com,2025-10-06T00:18:12.052360,GoogleNews
JavaScript,Baptize Technology: Sometimes Grace Speaks JavaScript,,Word on Fire,2025-10-06T00:18:12.052566,GoogleNews
JavaScript,Chainguard offers malware-resistant JavaScript libraries,,InfoWorld,2025-10-06T00:18:12.052766,GoogleNews
JavaScript,Introducing Chainguard Libraries for JavaScript: Malware-Resistant Dependencies Built Entirely from Source,,PR Newswire,2025-10-06T00:18:12.053564,GoogleNews
JavaScript,Version 4.33 of JavaScript Maps SDK released!,,Esri,2025-10-06T00:18:12.053766,GoogleNews
JavaScript,Top JavaScript Frameworks to Consider in 2025,,Netguru,2025-10-06T00:18:12.053948,GoogleNews
JavaScript,JSFireTruck: Exploring Malicious JavaScript Using JSF*ck as an Obfuscation Technique,,Palo Alto Networks,2025-10-06T00:18:12.054129,GoogleNews
JavaScript,JavaScript Gets Supply Chain Security With Chainguard Libraries,,The New Stack,2025-10-06T00:18:12.054369,GoogleNews
JavaScript,JavaScript vs Python: 2025 Guide to Two Programming Powerhouses,,Netguru,2025-10-06T00:18:12.054555,GoogleNews
JavaScript,Intro to Nitro: The server engine built for modern JavaScript,,InfoWorld,2025-10-06T00:18:12.054773,GoogleNews
JavaScript,Wasm 3.0 Offers New Way to Handle JavaScript Strings,,The New Stack,2025-10-06T00:18:12.055011,GoogleNews
