skill_query,title,description,source,publishedAt,platform
Rust,Three Rust Belt cities to visit via nonstop flights from St. Louis,,St. Louis Magazine,2025-09-30T17:21:08.623836,GoogleNews
Rust,The moon is rusting,,The Week,2025-09-30T17:21:08.624326,GoogleNews
Rust,Post Game: Rust (09.27.25),,NHL.com,2025-09-30T17:21:08.624809,GoogleNews
Rust,Meet Your Neighbor – Choir teacher inspires young singers,,The Cedar Mill News,2025-09-30T17:21:08.625284,GoogleNews
Rust,Mariners have the most wholesome plan possible to avoid playoff bye week rust,,Sodo Mojo,2025-09-30T17:21:08.625799,GoogleNews
Rust,Ubuntu 25.10's Move To Rust Coreutils Is Causing Major Breakage For Some Executables,,Phoronix,2025-09-30T17:21:08.626293,GoogleNews
Rust,Turning rust into fuel,,chemeurope.com,2025-09-30T17:21:08.626773,GoogleNews
Rust,The Moon Is Rusting — And Earth Is To Blame,,The Weather Channel,2025-09-30T17:21:08.627259,GoogleNews
Rust,Does anyone have a spare rusted sword?,"Got a Zacian from home, then sent it to violet, got the rusted sword, but when i sent it to shield, the sword was gone",PokemonSwordAndShield,2025-09-30T17:17:23,Reddit
Rust,OBS Ford frame painting/coating,"Hello I have a 97 f250 that I did some frame repairs to. That is all good but I want to coat it. So far I wire wheeled it and sprayed a coat of rust reformer primer so it didnt flash rust. At this point I could wire wheel that back off, use Ospho, neutralize/clean that off, and do an epoxy primer with a black enamel top coat.

I am just not sure which paints and primers to buy. I heard that the Majic 1 gal. Black Tractor Truck &amp; Implement Enamel Paint can be painted on with a brush and does require any additive but im not sure if thats true. Does tractor supply sell a good 2k epoxy primer that would work with that Enamel paint? I have also heard that people have used the rust oleum Pro paint and brushed it on. I am just looking for something I can get from store today! 

Any input of what I should buy to get this done would be really helpful.

ORRRRRR should I just do the POR 15 degreaser, metal prep, and the por 15 paint itself.",Autobody,2025-09-30T17:17:07,Reddit
Rust,Is this normal Benchmade return procedure?,"Purchased my first Benchmade knife and received it with the lock mechanism almost in a rusted state as when I would move it to open it, you could feel the grind. Definitely didn't feel like a new ($300) knife, felt like a knife that had been sitting on open display and gone through several different seasons of weather.

Did a chat with Benchmade support and they immediately said that wasn't normal and were going to send me a replacement with a return label. However I got no confirmation email other than an email asking me to rate their customer service and nothing showing up on my account when I log in either. Is this normal procedure? Only thing I have is a screenshot of the chat log with the rep, should I call and confirm this with their phone customer service or wait it out and hope it shows up.",knives,2025-09-30T17:16:05,Reddit
Rust,Deserted Carnival: Calliope Echoes for Children Who Never Stopped Playing,"You can hear it before you see it. That’s the strange part. The music comes thin and cracked, drifting through dead trees like smoke. The old calliope still plays, though everyone swears the carnival shut down decades ago. I didn’t believe it at first not when the stories were whispered in cafeterias, nervous kids daring one another to cross the dusty field where the Ferris wheel rusts against the skyline. I thought it was a myth. But then, one evening, I walked that way myself. I thought I’d only pass by. I thought it wasn’t real.

The song found me first air wheezing through busted brass pipes, uneven and wrong, like someone trying to remember a tune but forgetting the order with every breath. That’s when I smelled the faint, sweet burn of candied sugar. Imagine finding the scent of melting cotton candy when the midway is nothing but weeds and wire. That’s how it hooks you. It feels familiar. Warm. Almost like safety. And then the air begins to tighten around you, and it loses that warmth.

I stepped closer. I shouldn’t have.

The rides stand there, leaning forward, waiting. The carousel horses are frozen mid-gallop, their painted eyes peeled wide, chipped mouths open as if screaming. The games hang waiting too, prizes sagging in waterlogged rows, faded bears and rabbits with glassy eyes that look back. It feels like the moment just before lights turn on, just before the crowd comes pouring in except there is no crowd. Never again. But the carnival keeps itself alive, refusing to rot all the way through. And at the very center of it, I saw the calliope.

It doesn’t look like it should work. Rust crawls across its pipes, wooden panels blackened by weather and age. And yet, as I stood there, the keys pressed down one by one, invisible hands pounding out that chipped and broken song. It wasn’t just sound it was an invitation.

That’s when the children came.

They aren’t alive anymore. You see it instantly. Their movements stick and jolt, like puppets with tangled strings. Their clothes are wrong too, from different decades, stiff with years of dust. But their faces God, their faces those are not young anymore. They aren’t children’s faces, not really. Skin stretched too thin. Eyes sunken dark with hunger. Teeth chattering, though not from cold. Have you ever seen someone smile while starving? That’s what it looks like.

They came in shuffling groups, climbing down from Ferris-wheel seats, crawling out from the cracked funhouse mirrors, swinging stiff and slow from the monkey bars in the rusted playground beyond the gates. They whispered to each other in short, sharp bursts, giggling like kids playing hide and seek. But there was nothing playful in it. Their voices came out hollow, carved down by years of echoing through empty throats.

One girl stepped forward. A dirty lace bow still clung to her hair. She tilted her head at me, listening, as if I had already joined their game. “Tag,” she rasped, and her smile spread too wide.

The others followed her lead.

They ran without running. It’s hard to explain. One moment they were at the rides, the next they were closer, skipping forward in perfect rhythm with the blare of the calliope. Every note pulled them quicker, closer, their laughter cutting sharper, building and building and building. I tried to step back but my legs felt stiff, sluggish, the air around me folding in, weighing me down. The sound vibrated inside my chest, pressing against my ribs like it belonged inside me, not in the air at all.

The closer they came, the more real they felt not like ghosts, but like children who had never stopped playing, never stopped running, never stopped feeding off the carnival’s endless night. And I realized then that none of them looked older than twelve. They had been here a long, long time, but they weren’t allowed to grow. They were stuck between laughter and death, mouths stretching in the space between the two.

“Play with us,” the girl whispered. Only her mouth moved this time, her words sliding into my ears without sound. “Just one game.”

I don’t entirely remember what happened next. Running, maybe. Screaming though I couldn’t hear myself over the collapsing rush of music spilling from the calliope, louder and faster like organs tearing themselves apart. The rides spun. The lights snapped on for just a second, flooding the whole midway in white heat. I remember their faces in that flash children no longer, but dried husks carved into carnival masks, wide eyes and painted grins. Their fingers reached for me, thin as wires, twitching like claws, pulling at the air between us.

I remember falling. And then waking.

Not at home. Not in my bed.

Here.

The calliope is still playing now. I’ve been writing this while it screams in the background, because I don’t know what else to do. I’ve tried leaving. Every path I take bends back to the main gates. Beyond the field, only darkness. I can’t find the town anymore. What’s out there isn’t roads or grass or sky it’s something else, some endless black canvas that doesn’t end.

The music doesn’t stop, not for a second. It’s playing outside this tent where I’m hiding, its notes shaking the canvas, pressing through the ground. Every time I close my eyes I feel the children drawing closer, circling. I hear their bare feet scuffing the gravel, hear them humming along with the tune.

I think I understand now. I shouldn’t have come alone. Carnival games are always meant for two or more. That’s all they want. That’s why the gates keep opening every few years when someone wanders too close. Games can’t exist without players. And the children they never stop. They just wait for someone new to stumble inside.

The girl is standing outside my tent now. I can see her shadow against the fabric. She’s smiling. I can feel it sharp against my skin. And her voice, even softer than before, seeps through the canvas:

“Your turn.”",loudscarytruestories,2025-09-30T17:15:37,Reddit
Rust,Subject 047: The Thing in the Mine | True Horror / Creepypasta,"I need to tell someone what happened down there. Maybe writing this out will help me make sense of it. Or maybe I just need to warn others.

My name is Jake. I'm a coal miner in Appalachia. Was a coal miner. I don't think I can ever go back underground again.

# The Beginning

Another 12-hour shift. My hands were bleeding through my gloves, my back screaming with every swing of the pickaxe. But I kept going. I always keep going. My daughter Sarah has leukemia. Stage 3. Her treatment costs $340 every two weeks. Insurance doesn't cover half of it.

So I dig. I bleed. I break my body in the darkness so she can live in the light.

That day started like any other. Hard hat, LED headlamp, pickaxe over my shoulder. Down into the coal-black tunnels, wooden support beams creaking overhead, coal dust coating everything.

*Strike. Strike. Strike.*

The rhythm of survival. Each hit is a dollar. Each dollar is a dose of medicine. Each dose is another day for Sarah.

# The Discovery

Then my pickaxe hit something that shouldn't exist.

*CLANG!*

Not stone. Not coal. *Metal.*

I brushed away the debris with my gloved hands. A steel door. Heavy, industrial, buried under years of rock and coal. Warning symbols were corroded away, but I could make out edges of text: ""...AUTHORIZED PERSONNEL ONLY..."" ""...BIOHAZARD...""

Nobody knew this was here. No records. No maps. This section of the mine was abandoned in the 1970s.

I should have reported it. Should have walked away. Should have let it stay buried.

But I was curious. And tired. And stupid.

The door groaned as I pulled it open. My LED beam barely penetrated the darkness beyond. Cold air rushed out – wrong air, stale and rotten.

I stepped through.

# The Laboratory

My headlamp revealed an underground facility that shouldn't exist. Concrete floors cracked and stained. Metal examination tables overturned, leather restraints torn apart. Broken glass vials everywhere – hundreds of them, scattered like fallen stars.

Medical equipment. Rusted IV stands. Surgical tools. Monitoring devices with shattered screens.

And cages.

Metal cages with bars bent outward from the *inside*. Deep claw marks scored into the walls. Restraints hanging loose, torn through.

Whatever was kept here... escaped.

On one wall, I found a faded document behind cracked glass:

**PROJECT RESURRECTION** **Subject 047 - Status: CRITICAL FAILURE** **Age: 8 years** **Procedure: Cellular regeneration via tissue grafting** **Notes: Subject shows signs of consciousness but extreme aggression. Recommend immediate termination.**

Eight years old.

They experimented on a *child*.

# The Sound

That's when I heard it. Scratching. Slow, deliberate. Coming from the far corner of the lab, beyond my light's reach.

My hands gripped the pickaxe tighter. My heart hammered against my ribs.

""Hello?"" My voice cracked. ""Someone there?""

The scratching stopped.

Then I heard breathing. Wet, labored, struggling.

My headlamp flickered – the battery dying at the worst possible moment. In the strobing light, I saw it:

A pale shape. Crouched. Elongated limbs folded at wrong angles.

*Flicker.*

Glowing red eyes.

*Flicker.*

Black stitching across yellowish skin.

*Flicker.*

Numbers carved into its chest: **047**

My headlamp steadied. And I saw Subject 047 in full.

# The Monster

It was humanoid. Six feet tall but skeletal, emaciated. Pale yellowish skin stretched over bones. Black surgical stitching crisscrossed its entire body – arms, legs, torso, face. Like someone had torn a person apart and sewn them back together wrong.

Its limbs were too long. Too thin. Clearly attached surgically, different skin tones at the joints where they'd been grafted on.

But the worst part? Its face.

It still looked like a child. A child's features stretched and distorted. Eyes that glowed red like burning embers, but underneath... I could see they were still *human* eyes. Scared. Confused. In pain.

It wore a tattered hospital gown – cream colored, stained, with ""047"" printed on the chest.

We stared at each other. Man and monster. Predator and prey. Father and... another victim of a cruel world.

# The Connection

It moved closer. Not attacking – *crawling*. Its elongated limbs moved with jerky, puppet-like motions. It reached one stitched hand toward me, and I saw its fingers trembling.

It tried to speak. Its mouth opened, vocal cords damaged by whatever they'd done, and only a rasping whisper emerged:

""...hurts...""

God. It was still in there. The child was still in there, trapped in this nightmare body.

I lowered my pickaxe. ""I'm sorry,"" I whispered. ""I'm so sorry for what they did to you.""

Its glowing red eyes flickered – and for just a moment, they looked normal. Brown. A child's eyes. It saw me. Really *saw* me.

And I saw my daughter in its suffering.

# The Change

Then its body convulsed. It doubled over, clutching its stomach. The red glow in its eyes intensified.

Hunger.

It had been trapped down here for *decades*. Alone. Starving. Waiting.

The connection we'd shared vanished. The human consciousness retreated behind primal need.

It looked at me differently now. Not as a person. As *food*.

""Wait—"" I started backing away. ""Wait, I can help—""

It lunged.

# The Chase

I ran. Boots pounding coal dust, LED beam bouncing wildly off tunnel walls. Behind me, the creature pursued with unnatural speed, its elongated limbs carrying it in a horrific crawl.

*Left tunnel. Right. Another left.*

The mine was a maze. I'd worked here for three years and still got lost sometimes. Now I was running blind, my headlamp dying, the creature's glowing red eyes visible in my peripheral vision.

*Gaining. It was gaining.*

I turned a corner and slammed into solid rock. Dead end. I'd taken a wrong turn.

I spun around just as it reached me.

# The End

It tackled me to the ground. My headlamp flew off, clattering across the tunnel floor, casting crazy shadows. The creature's face was inches from mine, its breath cold and wrong.

Those red eyes... they flickered again. Human. Monster. Human. Monster.

It was fighting itself. The hunger versus what little humanity remained.

I stopped struggling. My hands fell to my sides.

""It's okay,"" I whispered, and I meant it. ""It's okay.""

I thought of Sarah. My beautiful daughter. I'd been killing myself slowly in these mines to keep her alive. Working myself to death for medicine money.

Maybe... maybe this was just a faster way to do the same thing.

This creature – Subject 047 – it had been a child once too. Taken. Experimented on. Tortured. Left to suffer alone in the dark for decades.

If my death could end its pain, even for a moment...

""I understand,"" I told it. ""I'm a father too. I know what it's like to hurt for your child. To do anything to make their pain stop.""

Its red eyes dimmed. Tears – actual tears – streaked down its stitched face.

It was grateful. And sorry. And so, so tired.

My last thought before everything went dark was simple:

*At least my suffering fed another child.*

# Epilogue

They found my hard hat three days later. My pickaxe. My wedding ring in the tunnel.

They never found me.

They sealed that section of the mine. Said it was structurally unsound. Dangerous. Nobody goes down there now.

But sometimes, miners in nearby tunnels report strange sounds. Scratching. Breathing. Crying.

And once, just once, someone's headlamp caught something moving in the deep darkness. Something pale. Something stitched together. Something with glowing red eyes that looked almost... peaceful.

Subject 047 isn't hungry anymore.

But it's still down there.

Still waiting.

Still alone.

**If you're reading this and you work underground – in mines, in tunnels, in caves – please. Be careful. Not everything buried should be found.**

**And not every monster chose to become one.**

**\[End\]**

# Author's Note:

This story was created as part of a horror fiction project combining narrative writing with AI-generated imagery. The full visual version of Subject 047's story is available on YouTube with 30+ scenes bringing this tragic tale to life.

**🎬 Watch the full visual story on YouTube:** SIGHTEDTUBE

If you enjoyed this story, please consider:

* Subscribing to the channel for more horror content
* Sharing your thoughts and theories in the comments
* Suggesting ideas for future horror stories

**⚠️ Content Warning:** The YouTube version contains disturbing imagery, horror elements, and mature themes. Viewer discretion advised.

 \#HorrorStory #CreepyPasta #NoSleep #UndergroundHorror #TrueHorror #ScaryStory #MiningHorror #Subject047",Sightedtube,2025-09-30T17:15:06,Reddit
Rust,Octopus Energy – £50 bonus credit for switching or up to £100 for green technology installation,"Octopus Energy are offering **£50 bill credit** for both referrer and referee when you switch both gas and electric to them using a referral link. They offer a unique ""Tracker"" tariff where their daily price follows the wholesale energy price, and it's cheaper than a fixed price tariff. 

Octopus may ask for details of the person who referred them, so please note down my username in case they ask so you can contact me.


**Instructions:**

1. Sign up using my referral link: **https://share.octopus.energy/rust-prawn-381** (read on for info about my other referral links)
2. Enter your post code and follow the steps to create a quote and compare this price against your current provider
3. Proceed with the switch
4. Receive confirmation email
3. **Both you and I receive £50 credit** after your first payment has been taken

There are no exit fees, so you can always leave Octopus if you are not satisfied.



*I also have separate links for those who book a green technology installation*

[Link to book a heat pump or solar panels installation through Octopus](https://tech.referrals.octopus.energy/us3cRbXA). **This gives a £100 gift card**. 

[Link to book Electric vehicle charger installation referral link](https://tech.referrals.octopus.energy/uXBe1wHE) **This gives a £25 gift card**. 



Non-referral link (no bonus): https://octopus.energy/
",beermoneyuk,2025-09-30T17:13:36,Reddit
Rust,Laser Rust Removal Machine | Fast &amp; Precise Cleaning,"Upgrade your cleaning process with our[ laser rust removal machine](https://printandlaser.com/product/300w-500w-pulse-laser-cleaning-machine-laser-metal-rust-remover-laser-rust-oil-paint-coating-fine-cleaning-machine/). It provides non-abrasive, eco-friendly rust removal for metals and machinery. Perfect for workshops, industries, and restoration projects, this advanced technology ensures long-lasting results while saving time and maintenance costs. Experience cleaner surfaces with modern laser innovation.",u_printandlaser,2025-09-30T17:11:35,Reddit
