skill_query,title,description,source,publishedAt,platform
Go,‘Here We Go!’: Trump Weighs in After Russian Drones Shot Down Over Poland,Trump's tweet has the tone of a 1990s standup comedian.,Gizmodo.com,2025-09-10T18:40:24+00:00,NewsAPI
Go,"Want to Watch ‘Demon Slayer: Infinity Castle’? Go to a Theater, Crunchyroll Says","Sorry, anime fans: a Crunchyroll exec says the big screen will be the only place to watch 'Infinity Castle' this year.",Gizmodo.com,2025-09-19T21:00:48+00:00,NewsAPI
Go,Lego Game Boy Hands-On: Nintendo Didn’t Need to Go This Hard,This has to be the Lego set of the year.,Gizmodo.com,2025-09-19T20:40:48+00:00,NewsAPI
Go,The End of Those Annoying Cookie Pop-Ups on Websites?,"Instead, users might be able to set cookie preferences on their browsers that can go for every website.",Gizmodo.com,2025-09-22T15:10:33+00:00,NewsAPI
Go,The Return of the ‘Razor Crest’ in ‘The Mandalorian and Grogu’ Sucks,"Whether it's the actual ship or not, it's just one thing among many that 'The Mandalorian' is unwilling to let go.",Gizmodo.com,2025-09-26T21:30:23+00:00,NewsAPI
Go,David Tennant and Billie Piper Have a ‘Doctor Who’ Pitch,"The return of 'Doctor Who' isn't certain, but two of its best-loved stars have a suggestion of where to go next.",Gizmodo.com,2025-10-02T19:20:22+00:00,NewsAPI
Go,Ed Davey urges regulator to go after Musk over X 'crimes',The Lib Dem leader urges Ofcom to launch an investigation into the tech mogul and his social platform.,BBC News,2025-09-21T05:01:43+00:00,NewsAPI
Go,The Whole 10 Yards,How far can the Steelers go with one of America's most talked about quarterbacks?,BBC News,2025-09-09T19:46:46+00:00,NewsAPI
Go,Great Train Robbery court files found in cellar,"Photos, letters and other documents will go on sale at an auction.",BBC News,2025-09-05T04:45:04+00:00,NewsAPI
Go,"Flags, wars and fantasy kingdoms: Turner Prize artists show us their worlds",Work by the four artists nominated for this year's award will go on show in Bradford this weekend.,BBC News,2025-09-27T01:25:33+00:00,NewsAPI
Go,Lenovo’s new concept laptop has a rotating screen that’s perfect for doomscrolling,"Lenovo has made laptop screens that roll, flip, and go transparent, and now for IFA 2025 it’s announcing a new concept with a screen that can rotate into portrait mode. The Lenovo ThinkBook VertiFlex Concept is a pretty standard-looking 14-inch productivity l…",The Verge,2025-09-04T21:54:40+00:00,NewsAPI
Go,8BitDo’s wireless N64-inspired controller is 30 percent off,"Look, delays happen. The Analogue 3D, a console made to display N64 games in 4K, has had its release window pushed multiple times. That frustrated me for a while because I wanted to get my hands on 8BitDo’s slick 64 Bluetooth controller that was made to go al…",The Verge,2025-09-17T15:09:25+00:00,NewsAPI
Go,"The Surrey restaurants, book shops, Lego café and Pickleball clubs either opened recently or coming soon",From Guildford to Godalming and Oxted to Caterham Surrey residents have a lot of new things to try out,getsurrey,2025-10-05T06:45:00,NewsData
Go,Robins will keep coming back to gardens if you grow 7 plants they naturally love,"Autumn is when gardens start to die off, but there is a simple way to keep your outdoor space busy and also help out any local robins if you grow certain plants in October.",expresscouk,2025-10-05T06:45:00,NewsData
Go,"Eric Dane misses 2025 Emmys; Fights ALS while hospitalized, Finds strength in family support","Actor Eric Dane revealed he missed the 2025 Emmys, where he was scheduled to present, because he was hospitalized due to his struggles with amyotrophic lateral sclerosis (ALS). He expressed disappointment over the missed opportunity but remains determined to continue his career. Dane relies on his wife and daughters for support, maintaining a buoyant spirit despite the challenging neurodegenerative disorder.",toi,2025-10-05T06:44:56,NewsData
Go,"Jayud Global Logistics Stock to Reverse Split on Monday, October 13th (NASDAQ:JYD)","Jayud Global Logistics Limited (NASDAQ:JYD – Free Report)’s stock is going to reverse split on Monday, October 13th. The 1-50 reverse split was announced on Friday, October 3rd. The number of shares owned by shareholders will be adjusted after the market closes on Friday, October 10th. Jayud Global Logistics Price Performance Shares of JYD opened [...]",americanbankingnews,2025-10-05T06:44:47,NewsData
Go,What Ohio State showed the country in its 42-3 win over Minnesota: Buckeye Talk podcast,"Stephen Means, Stefan Krajisnik and Andrew Gillis discuss Ohio State's win over Minnesota.",cleveland,2025-10-05T06:44:15,NewsData
Go,IND vs PAK Women’s World Cup 2025: Will rain spoil the fun of the much-awaited clash?,"India and Pakistan are going to face each other in the Women's World Cup at the R Premadasa Stadium in Colombo. However, there is a chance of rain spoiling the match.The post IND vs PAK Women’s World Cup 2025: Will rain spoil the fun of the much-awaited clash? appeared first on Cricket Country.",cricketcountry,2025-10-05T06:44:03,NewsData
Go,Gary Neville blasts ‘naive’ Liverpool star in Chelsea defeat: ‘He looks like a baby’,"Manchester United legend Gary Neville thinks Milos Kerkez ""looks like a youth team player"" after Liverpool lost 2-1 to Chelsea on Saturday,",football365,2025-10-05T06:44:02,NewsData
Go,'We get the bulk of the noise - during a party it turns into an amphitheatre',The venue has been granted a new licence to hold outdoor events - amid concerns from local residents,nottinghampost,2025-10-05T06:43:55,NewsData
Go,"Nepal: Heavy rains kill 22, block roads","Tribune OnlineNepal: Heavy rains kill 22, block roadsAuthorities said eleven people were swept away by floods and have been missing since Saturday.Nepal: Heavy rains kill 22, block roadsTribune Online",tribuneonlineng,2025-10-05T06:43:51,NewsData
Go,"Bronny James has a rough shooting night, but makes progress in his quest to earn a role with Lakers","PALM DESERT, California — Three days shy of a year after Bronny James made his preseason debut with the Los Angeles Lakers in this desert arena, the NBA’s most famous son resumed his quest to show he belongs in the big leagues.While his 1-for-12 shooting performance in the Lakers' opener wasn’t ideal, James felt his effort Friday night was another step forward in a process that’s already showing results to coach JJ Redick.Bronny James scored eight points while LeBron James and Luka Doncic sat out of the Lakers’ 103-81 loss to the Phoenix Suns.Bronny's 40-year-old father is progressing deliberately in his return from a minor nerve injury to begin his record 23rd NBA season, while Doncic is also ramping up with caution after his busy summer playing for Slovenia at EuroBasket.That left plenty of playing time in the Coachella Valley for depth players like Bronny James, who hit a 3-pointer late in the third quarter for his only field goal. He missed his other seven 3-point attempts while struggling for buckets alongside fellow 2024 draft pick Dalton Knecht, who was 2 for 10 with 1-for-7 shooting from distance.“I felt like they were pretty good shots,” said Bronny James, who turns 21 years old on Monday. “Not rushed, not forcing anything. Didn’t have my legs under me as much as I wanted to, so a lot of them were short, but most of them were on line. I felt like I could have made those. I felt like I took some good shots.”Bronny's confidence was undiminished by those misses after the Lakers opened their preseason in the same arena where Bronny James first played alongside his famous father in October 2024.The Palm Springs-area fans who rumbled with anticipation whenever Bronny touched the ball a year ago didn’t react much this time around. The novelty of Bronny’s presence has faded while he continues to grow into something much more than a sideshow.Bronny was in the Lakers’ first substitution group, and he played nearly 23 minutes. He gave a consistent defensive effort with intermittent effectiveness as he works to become the impact defender that Redick believes he can become with more growth.“Definitely felt like I was more comfortable, especially with the ball in my hands, and with the defensive and offensive schemes,” Bronny said. “But I’m just trying to feel it out. Feeling my way still and just continuing to grow.”Bronny appeared in 27 games for the Lakers during his rookie season, even making basketball history by playing alongside his father in the opener. But he accomplished much of his growth in the G League, where he averaged 21.9 points and 5.5 assists for the Lakers’ affiliate.After a summer of hard work, Bronny is demonstrating progress to Redick.“He is so much more comfortable and confident as a player,” Redick said of Bronny. “Skill-wise, read-wise, all of those things have improved, but there’s a big difference between improving those things in individual workouts and small group settings, and doing it 5-on-5.... He’s a totally different player than he was a year ago. I thought the stuff that he did down in the G League last year was huge for him in developing a comfort level in playing at this level.”Austin Reaves scored 20 points to lead the Lakers’ starters, which included newcomers Deandre Ayton and Jake LaRavia with Rui Hachimura and Jarred Vanderbilt.Bronny James wasn't the only Lakers player trying to stand out on defense. Ayton had eight rebounds and just one point while taking only two shots in 18 minutes, but he also blocked two shots while demonstrating his commitment to protecting the rim.The Lakers’ preseason continues Sunday against the Golden State Warriors. Redick said Doncic also will sit out that game in San Francisco, as will LeBron James.That means Bronny James will have more chances, and he remains determined to seize them.“I’m just trying to feel it out, trying to get some reps in with the guys,” Bronny said. “There’s probably not going to be as many opportunities during the season, so I’m just coming out and defending hard, playing my game, doing the non-negotiables. So if JJ sees that, maybe he’ll give me an opportunity.”",manilatimes,2025-10-05T06:43:30,NewsData
Go,Carson Wentz finds Jordan Addison for go-ahead TD pass to lift Vikings over Browns,,Fox News,2025-10-06T00:17:41.543888,GoogleNews
Go,Go-Go Museum & Cafe starts ‘Sustaining the Beat’ campaign,,WTOP,2025-10-06T00:17:41.545030,GoogleNews
Go,Formula 1: McLaren clinches 2025 constructors' championship with six races to go,,Yahoo Sports,2025-10-06T00:17:41.546007,GoogleNews
Go,Naylor might go on paternity list during ALDS,,MLB.com,2025-10-06T00:17:41.546883,GoogleNews
Go,René Magritte’s ‘superstar of surrealism’ to go on sale in Paris,,The Guardian,2025-10-06T00:17:41.547737,GoogleNews
Go,Where did Bill Belichick’s UNC roster go wrong? What we’re hearing entering Week 6,,The New York Times,2025-10-06T00:17:41.548636,GoogleNews
Go,What is next for Penn State after critical loss at UCLA?,,Nittany Lions Wire,2025-10-06T00:17:41.549475,GoogleNews
Go,Opinion | This Is No Time to Go Wobbly on ObamaCare,,The Wall Street Journal,2025-10-06T00:17:41.550472,GoogleNews
Go,Holiday Express tickets go on sale Oct. 14,,WRAL.com,2025-10-06T00:17:41.551512,GoogleNews
Go,"EA's Deal to Go Private Could Be Good for Investors, Bad for Employees",,Bloomberg.com,2025-10-06T00:17:41.552461,GoogleNews
Go,"Know Before You Go: MNUFC vs. Sporting Kansas City | October 4, 2025",,Minnesota United FC,2025-10-06T00:17:41.553288,GoogleNews
Go,Pikachu wearing an Indonesia football jersey is coming back for Golden Goal Time with Pikachu!,,Pokemon Go,2025-10-06T00:17:41.554181,GoogleNews
Go,KNOW BEFORE YOU GO: Spirit vs. San Diego Wave,,Washington Spirit,2025-10-06T00:17:41.555000,GoogleNews
Go,Where Do Democrats Go From Here? History Class Would Be a Good Start.,,Politico,2025-10-06T00:17:41.555809,GoogleNews
Go,"College football upsets yesterday: Penn State, Texas go down in Week 6",,USA Today,2025-10-06T00:17:41.556670,GoogleNews
Go,Letting Go of Your Grown Child,,Dr. James Dobson Family Institute,2025-10-06T00:17:41.557474,GoogleNews
Go,"Trump's top economic adviser threatens layoffs if shutdown negotiations go ""nowhere""",,CNN,2025-10-06T00:17:41.558322,GoogleNews
Go,Jiří Procházka | Let’s Go For That,,UFC.com,2025-10-06T00:17:41.559128,GoogleNews
Go,Protester shot in Chicago by border patrol agents who claim they were 'ambushed' by convoy,,"ABC News - Breaking News, Latest News and Videos",2025-10-06T00:17:41.559968,GoogleNews
Go,"Man, 33, and 11-month-old daughter go missing in South Los Angeles",,NBC Los Angeles,2025-10-06T00:17:41.560763,GoogleNews
Go,Cheers to the Tin Man this Halloween,"I'm going to a pumpkin carving event later today so I threw together this stencil. It's not my best work, but I had little time to throw it together. Regardless, I figured people here may want it to spread some anti-nazi love this halloween.",CreatureCommandos,2025-10-06T00:09:16,Reddit
Go,Late Night Talks,"We had our chance to speak last night.

It didn’t go how either of us wanted to.

On my end, I was still holding out some hope in you as a person. I think you thought you handled it well, but really you reacted just as I thought you would. Rather than angry or anything, it just makes me sad for you. 

All your relationships are going to and up the same way. Friendships, too, until it clicks. 

I’m still holding out for a little hope, but I think you’re going to protect yourself (and in the end, hurt yourself) by thinking I took things way out of context. 

You’re probably trying to remember all the things you said, and going “I didn’t mean it that way” or “what did I say??!”

The thing is though, our conversation last night just proved to me I didn’t take it out of context at all. You were hypocritical, avoidant, and manipulative. I think (or I’d like to) that you just don’t realize what you’re doing-that you had to be like that growing up to protect yourself and your brother and it’s all you know. That you’re just trying to protect yourself by throwing out anything you think will work, and each time you do you convince yourself of of what you’re saying, too. 

And I said (and believe) whole heartedly that I think you do actually care, and that’s what makes this whole thing so sad.

I’ll still be your friend, because I think friendship is one of the most important things in our lives and I think you need that kind of love, support, and challenge in your life more than anything. It will also be easier to distance myself when I need to.

I truly wish you the best, and that you can find the healing you need.

-M

",UnsentLetters,2025-10-06T00:08:54,Reddit
Go,How will my Jupiter MD be? Been going through a very tough Rahu MD,"Hi all, i have been going through a really tough rahu mahadasha with nothing actually going my way in terms of career, health, higher education, relationships etc . Just wanted to know if jupiter and saturn md will also be the same cuz then ill be mentally prepared for it. 18 years of rahu mahadasha has been very tough hence just wanted to know if the next 16 and 19 years will also be the same according to my chart. Request if anyone could provide an insight, Thank you in advance.",vedicastrologyexperts,2025-10-06T00:08:51,Reddit
Go,30 [F4M] #SoCal - submissive babygirl looking for older Daddy Dom to teach her all about the fun she’s missed out on,"Hi there

I’m looking for a dominant man at least 5’9 (I’m 5’8) and 35 years old (I like older men) who lives in SoCal, specifically Orange County. I’m not looking for hook ups, one night stands, or a friends with benefits situation. I’m looking for a real in person BDSM Dom/sub dynamic within a long term committed relationship.

Early last year, I got out of a decade long mostly vanilla relationship and am trying to find myself in all the chaos. I’m here to meet new people, have some kinky fun, and try to move on with my life!

A bit about me:
- Hobbies/interests include Disney, literature, board games, theater, baking, animals, museums, nature walks (not hiking, I’m not athletic), and staying home and being lazy
- In order for me to enjoy sex, my mind must be seduced first so I enjoy getting to know people on here for a short time before meeting in person. Also, please be okay with not immediately going behind closed doors together and fucking right when we meet. That’s not my styl. At least buy me a drink first ;)
- I’m plus size, kind of tall at 5’8, have brown hair and blue eyes, and I’ve been told a very innocent looking face
- The physical “type” I’m most attracted to is over 35 years old, big, tall, and beardy. I’m sorry but just how not everyone is attracted to plus size bodies, I’m not attracted to slim or extremely fit bodies. So middle aged burly dudes to the front please!
- I’m looking for someone SINGLE as I want to keep the possibility of a long term romantic relationship. I am NOT just looking for sex with no strings attached or a friend with benefits. I’m looking for a real relationship with a Dom/sub dynamic
- Vaccinated, liberal, 420 friendly and looking for the same!

Let’s get to know each other!",r4r,2025-10-06T00:08:48,Reddit
Go,NTG35 1800k worth it in D3AA,"So I am going to make another poor financial decision soon and order a bunch of new lights after seeing how much I like the NTG50 4200k and want to try the NTG35 emitters in different hosts. 

The NTG35 1800k is intriguing even though I am not sure I will like something that warm (but I said that about 3500, 2700, and rosy emitters all before), but my biggest concern is how much lower the output is lumen wise. 

Is it worth it to use this emitters in a D3AA or would it be better to go with a D4K (or even D4V2) to get the fourth emitter to make up for the roughly 30% less lumens? ",Hanklights,2025-10-06T00:08:38,Reddit
Go,Could Bupropion work for me?,"Hi all, recently diagnosed ADHD'er here (23M). I've been running the gauntlet of ADHD meds and I think stimulants just aren't for me, as I've had adverse reactions to both Vyvanse and Adderall (anxiety, severe heart racing, fatigue during exercise, etc.). I'm likely going to meet with my doctor next week to discuss non-stimulant options. I've looked into what is available and honestly bupropion seems to be the best fit based on my non-medical judgement. I have struggled with chronic fatigue, brain fog, and poor motivation since my teen years. This is something I had no idea was related to ADHD, but after being diagnosed, I was informed this is common in adults who go undiagnosed, and it can be treated with the right medication. I've read that Wellbutrin/Buproprion can be extremely helpful for these symptoms, but I do have a few reservations given the side effects I've had on other drugs. So, I have a few questions for the community:

1)If you, like me, had adverse anxiety/heart symptoms on stimulants, did you also experience this on Wellbutrin. If so, did it go away eventually? 

2) How much does it really help with your ADHD symptoms, like deficits in focus and attention?

3) Are there any sexual side effects? I know from past experience I am sensitive to the sexual side effects on SSRIs. Though I know this isn't as much of a concern for Bupropion, I'm still somewhat worried.",bupropion,2025-10-06T00:08:38,Reddit
Go,"as cyrene's current kit looks, do i get her e0 or cas e2","i currently have cas e1 (got her on a double on her release then lost to clara trying for e2)

with how cyrene's current kit looks would cas e2 or her be better? and if i have enough jades can go for pity twice (5050) who do i go for first?

",CastoriceMains_,2025-10-06T00:08:37,Reddit
Go,4th Gen V8 —&gt; LC200? Talk me out of it,"My 2009 V8 Limited has 300k miles on it. It’s at a point where I’m going to have some expensive preventative maintenance. 

New shocks 
Front end work 
Brakes 
Cracked manifold 
Timing belt 
And more 

If I go down that path, I will want to keep it for another 100k miles. I am starting to wonder if I should just get an 09-15 LC200 because I have always wanted an LC. The LC200 is safer for our kid than an LC100. 

This would be primarily a road trip and camping rig. We like to camp as far from people as possible so I need the 4x4 capabilities. Otherwise I would get a Sienna. We have a RAV4 hybrid for around town. 

If you have owned both, let me know what you think. ",4Runner,2025-10-06T00:08:36,Reddit
Go,He ghosted me after saying he'd come to an event... after we'd been getting close,"There’s this guy in my class I’d been talking to a lot. We’ve hung out outside of school, joked around, and always had fun — I really thought there was a connection. We’d look for each other in class, talk about music, laugh — it just felt natural.

I invited him to a school event, and he said he’d go. I was excited, but when the day came, he completely ghosted me — no text, no explanation. I even saw him walking with his friends, which hurt.

I called him because I was frustrated, and he acted confused like he didn’t know what I was talking about. I knew his friends were around, so it felt like he was pretending not to care. I told him he didn’t have to say yes if he didn’t want to go, and how rude it was, then hung up.

He never apologized, but now he’s suddenly everywhere — walking past my classes, going out of his way to walk near me, pretending not to notice but obviously paying attention. He doesn’t joke or dance like he used to, not even with anyone else.

It’s like all that energy was just for me.

He’s also started talking to random girls, and I’m pretty sure it’s just to get my attention. But when I ignore it and hang out with my friends, he immediately stops talking to them.

I haven’t been friendly — not rude, just distant. I’m avoiding him to see if he’s genuinely sorry. When I’m quiet, he’s fine, but when I’m laughing with my friends, he gets tense and quiet. It’s like he wants me to notice him while acting like he doesn’t care.

He used to mirror me — my texts, my mannerisms, even made a necklace similar to my pop tab bracelet. Sometimes he’d get jealous or competitive, like he didn’t know how to deal with liking someone.

Ever since that call, he’s been totally different — no jokes, no excitement, just distant.

I don’t know if he’s genuinely sorry, playing games, or just confused about his feelings. How should I handle this? Should I confront him, keep my distance, or just move on?
",dating_advice,2025-10-06T00:08:35,Reddit
Go,Go! Figure on iOS,I would give Warner brothers my soul if I can get this game on iPhone  or iPad ,teenytitans,2025-10-06T00:08:32,Reddit
Go,Why are the price curves of hotels and flights different?,"No matter how hard i look, i cant seem to find any crazy last-minute flight deals anywhere. meanwhile these equivalent hotel deals are fairly common. id assume that since hotels and flights go hand in hand, theyd follow the similar dynamic pricing structure and thus either both or neither have a fire sale right before the scheduled date

My only theory is that since airlines participate in an oligopoly, they have less competition that can undercut prices and thus can train the market to only book early for cheap flights. meanwhile theres enough hotels that last minute price inflation cant exist",AskEconomics,2025-10-06T00:08:31,Reddit
Go,Pea gravel and grass,I’m going to remove the bulk or all of this pea gravel to replace with grass and some pavers.  The kids like it but I can’t be picking pea gravel out of the grass for the next 10 years.  The gravel is about 4 inches deep on top of landscaping fabric.  What practice would be better? All or most and add top soil? Also any ideas on how to purpose this spot are welcome. Current idea is to put some lounge chairs there and still have it as a play area. Which why I’m thinking some pavers spaced out purposely.,landscaping,2025-10-06T00:08:31,Reddit
Go,Definition of Master Set or Complete Set,"Hey everyone!

So, I've been in Pokemon collecting again since mid-XY era. Something that I've personally seen different ideas on is the definition of a ""master set"" or ""complete set"".

For me, I've always considered the two as separate things.

A ""complete set"" has been one of every card that can be pulled from the set. So all of the base cards (either regular/holo or reverse holo) and then the full arts, IRs, SIRs, etc. If you can go from the first card to the last card in the set without skipping anything, then it's a complete set.

A ""master set"" has been one of every card that can be pulled from the set, but (sorta) doubled. Essentially, a full complete set of the regular/holo, full arts, IRs, etc, and then a full set of the same cards that have a reverse holo variant. And in a case like Prismatic Evolutions or White Flare and Black Bolt, this would also include getting all of the Poke Ball and Master Ball variants present. This doesn't include promo variants of the cards, at least not at this time.

I'm collecting my definition of Master sets for every set, along with a personal side collection

What kinds of definitions do you have for this? Do you collect any full sets? How do you have them organized?",PokemonTCG,2025-10-06T00:08:31,Reddit
Go,Which length would you say suits me better? Undecided if I should keep my current length or go to another style (last two photos is my current hairstyle),"I've had long hair for years, then cut to short, then buzz cut, then grew a bit again and back and forth. Currently I've been having medium hair, to enhance my waves and small curls, but it gets hard to tame and control frequently, specially in the days when I do not wash my hair \*sigh\*",malehairadvice,2025-10-06T00:08:29,Reddit
